id, store, business, location, x, y, url
807917550, 할리스 제주도두해안DT점, 카페, 제주특별자치도 제주시 서해안로 254, 126.47294580039188, 33.50903560477169, http://place.map.kakao.com/807917550
19336782, 할리스 목포평화점, 카페, 전남 목포시 미항로 129, 126.434376354769, 34.7967428218099, http://place.map.kakao.com/19336782
1481603662, 할리스 남악신도시점, 카페, 전남 무안군 삼향읍 남악로 234, 126.46387391159365, 34.80423085047775, http://place.map.kakao.com/1481603662
10924432, 할리스 목포하당점, 카페, 전남 목포시 비파로51번길 37, 126.42312243084366, 34.801295238616255, http://place.map.kakao.com/10924432
1820391410, 할리스 부안격포채석강점, 카페, 전북 부안군 변산면 채석강길 22-6, 126.4711790043673, 35.62848883474361, http://place.map.kakao.com/1820391410
2072221014, 할리스 군산선유도점, 카페, 전북 군산시 옥도면 선유북길 125-1, 126.41037977102472, 35.81383469877206, http://place.map.kakao.com/2072221014
412194032, 할리스 인천공항T1점, 카페, 인천 중구 공항로 272, 126.45216689854884, 37.449786325755625, http://place.map.kakao.com/412194032
27771816, 할리스 제주연북로점, 카페, 제주특별자치도 제주시 오남로 166, 126.515336952574, 33.4813314604689, http://place.map.kakao.com/27771816
13109630, 할리스 제주이도점, 카페, 제주특별자치도 제주시 승천로 71, 126.54272630585, 33.4926567918177, http://place.map.kakao.com/13109630
179417236, 할리스 이도점, 카페, 제주특별자치도 제주시 중앙로 302, 126.53412753385, 33.4938572413408, http://place.map.kakao.com/179417236
526529319, 할리스 새만금산단점, 카페, 전북 군산시 새만금북로 424, 126.58270708350722, 35.94685637389896, http://place.map.kakao.com/526529319
1510778499, 할리스 영종하늘도시점, 카페, 인천 중구 하늘달빛로 90-21, 126.559438049035, 37.4864984956868, http://place.map.kakao.com/1510778499
27588341, 할리스 서천휴게소목포방향점, 카페, 충남 서천군 비인면 서해안고속도로 169, 126.6264803604, 36.1295809546496, http://place.map.kakao.com/27588341
1562247500, 할리스 충남도청점, 카페, 충남 홍성군 홍북읍 청사로174번길 25, 126.68108236057675, 36.66034946114863, http://place.map.kakao.com/1562247500
1804898085, 할리스 당진시청점, 카페, 충남 당진시 시청2로 49-25, 126.646669476222, 36.8876731536725, http://place.map.kakao.com/1804898085
846605987, 할리스 당진푸르지오점, 카페, 충남 당진시 북문로2길 4, 126.630011209282, 36.9001476505211, http://place.map.kakao.com/846605987
26469914, 할리스 인천한옥마을점, 카페, 인천 연수구 테크노파크로 180, 126.63881441244548, 37.39081017753961, http://place.map.kakao.com/26469914
875995276, 할리스 인천대입구역점, 카페, 인천 연수구 인천타워대로132번길 34, 126.6439452878631, 37.38636389411203, http://place.map.kakao.com/875995276
1153393682, 할리스 송도학원가점, 카페, 인천 연수구 신송로 168, 126.64867575041013, 37.398635492045194, http://place.map.kakao.com/1153393682
13500043, 할리스 송도IT점, 카페, 인천 연수구 송도과학로 32, 126.661684366425, 37.381921687637, http://place.map.kakao.com/13500043
718475864, 할리스 인천주안역점, 카페, 인천 미추홀구 주안로 105, 126.681339141848, 37.4642352738843, http://place.map.kakao.com/718475864
85341279, 할리스 인천엠파크허브점, 카페, 인천 서구 염곡로 52, 126.66569287885906, 37.490104967099725, http://place.map.kakao.com/85341279
2110077476, 할리스 인천연수CGV점, 카페, 인천 연수구 청능대로 210, 126.6831679739042, 37.40635555180109, http://place.map.kakao.com/2110077476
22378608, 할리스 청라센터시아점, 카페, 인천 서구 중봉대로612번길 16, 126.65138621588731, 37.53398916599193, http://place.map.kakao.com/22378608
64088886, 할리스 인천서구청점, 카페, 인천 서구 서곶로301번길 7-1, 126.675738905582, 37.5443605365833, http://place.map.kakao.com/64088886
13057650, 할리스 인천당하점, 카페, 인천 서구 서곶로 788, 126.67534989063937, 37.58812066100654, http://place.map.kakao.com/13057650
25671608, 할리스 인천검단사거리점, 카페, 인천 서구 검단로 465, 126.65599091124918, 37.60169866848072, http://place.map.kakao.com/25671608
535991266, 할리스 김포디원시티점, 카페, 경기 김포시 김포한강10로133번길 127, 126.617975213865, 37.6444369534393, http://place.map.kakao.com/535991266
1153983470, 할리스 김포운양점, 카페, 경기 김포시 김포한강11로255번길 15, 126.6768827960344, 37.65357954908789, http://place.map.kakao.com/1153983470
22399012, 할리스 김포골드밸리점, 카페, 경기 김포시 양촌읍 황금로109번길 27, 126.62233205458152, 37.61731703534676, http://place.map.kakao.com/22399012
1335492436, 할리스 김포지식산업센터점, 카페, 경기 김포시 태장로795번길 145, 126.68448559356143, 37.64044311593858, http://place.map.kakao.com/1335492436
1783228474, 할리스 나주빛가람혁신도시점, 카페, 전남 나주시 배멧3길 5-4, 126.78579651602801, 35.01874195820527, http://place.map.kakao.com/1783228474
2002817648, 할리스커피 나주빛가람혁신점, 카페, 전남 나주시 배멧3길 5-4, 126.785710674824, 35.0188869286109, http://place.map.kakao.com/2002817648
27588321, 할리스 전북고창점, 카페, 전북 고창군 고창읍 중앙로 195, 126.69696752691435, 35.43536993452082, http://place.map.kakao.com/27588321
94458695, 할리스 전북부안점, 카페, 전북 부안군 부안읍 석정로 269, 126.737656034472, 35.7215449234268, http://place.map.kakao.com/94458695
1168927823, 할리스 군산수송점, 카페, 전북 군산시 수송북로 22, 126.716528489586, 35.966731755987, http://place.map.kakao.com/1168927823
27588129, 할리스 군산미장점, 카페, 전북 군산시 미장안길 54, 126.726879646104, 35.9690052445879, http://place.map.kakao.com/27588129
324197918, 할리스 월곶점, 카페, 경기 시흥시 월곶중앙로 63, 126.738066830625, 37.3887407395056, http://place.map.kakao.com/324197918
21214402, 할리스 스틸랜드점, 카페, 경기 시흥시 오이도로 21, 126.701461533771, 37.3464203368588, http://place.map.kakao.com/21214402
25811403, 할리스 인천구월로데오점, 카페, 인천 남동구 인하로 497-24, 126.702161649297, 37.4444998082482, http://place.map.kakao.com/25811403
1392231110, 할리스 부평로데오점, 카페, 인천 부평구 시장로 17-1, 126.724694161124, 37.4928088352624, http://place.map.kakao.com/1392231110
13057614, 할리스 부천송내본점, 카페, 경기 부천시 송내대로73번길 21, 126.75290897548184, 37.490222260787604, http://place.map.kakao.com/13057614
70689712, 할리스 간석오거리점, 카페, 인천 남동구 남동대로 931, 126.707585607703, 37.4654816546946, http://place.map.kakao.com/70689712
1349244152, 할리스 인천시청점, 카페, 인천 남동구 남동대로799번길 36, 126.705804723625, 37.4543695938546, http://place.map.kakao.com/1349244152
2070876817, 할리스 부천심곡점, 카페, 경기 부천시 장말로 376, 126.78363939931548, 37.48978518028361, http://place.map.kakao.com/2070876817
19336943, 할리스 간석역남부점, 카페, 인천 남동구 석산로 11, 126.694954738041, 37.463835117493, http://place.map.kakao.com/19336943
1078225088, 할리스 2001아울렛부평점, 카페, 인천 부평구 경원대로 1277, 126.71043122588294, 37.49055736497971, http://place.map.kakao.com/1078225088
1945731887, 할리스 부천순천향병원점, 카페, 경기 부천시 조마루로 170, 126.762823823541, 37.498657066539, http://place.map.kakao.com/1945731887
16159756, 할리스 부천중동점, 카페, 경기 부천시 소향로 203, 126.77030184521, 37.5013865691762, http://place.map.kakao.com/16159756
1616485514, 할리스 김포한강생태공원점, 카페, 경기 김포시 김포한강11로 452, 126.698241279493, 37.6536757610861, http://place.map.kakao.com/1616485514
13057643, 할리스 라페스타입구점, 카페, 경기 고양시 일산동구 중앙로1275번길 38-15, 126.77017432293444, 37.660034777394785, http://place.map.kakao.com/13057643
1174932638, 할리스 김포시청점, 카페, 경기 김포시 김포대로 847, 126.7195051013429, 37.61959271601335, http://place.map.kakao.com/1174932638
12508517, 할리스 마두역점, 카페, 경기 고양시 일산동구 중앙로 1165, 126.7781237264157, 37.6507879169928, http://place.map.kakao.com/12508517
667301727, 할리스 일산문촌마을점, 카페, 경기 고양시 일산서구 중앙로 1493, 126.75545759069854, 37.67231255378888, http://place.map.kakao.com/667301727
361834333, 할리스 김포농협본점, 카페, 경기 김포시 홍도평로 20, 126.713003773875, 37.6315736851335, http://place.map.kakao.com/361834333
1408080454, 할리스 롯데시네마 라페스타점, 카페, 경기 고양시 일산동구 무궁화로 32-34, 126.768799022032, 37.661320490735, http://place.map.kakao.com/1408080454
19336796, 할리스 일산레이킨스몰점, 카페, 경기 고양시 일산서구 호수로 817, 126.75127908336121, 37.66768179948902, http://place.map.kakao.com/19336796
1927407761, 할리스 파주야당역점, 카페, 경기 파주시 경의로 1042, 126.75983692865, 37.7104417968643, http://place.map.kakao.com/1927407761
815895287, 할리스 파주운정역점, 카페, 경기 파주시 경의로1240번길 37-1, 126.76367641886512, 37.728814037971745, http://place.map.kakao.com/815895287
1410086979, 할리스 파주탄현점, 카페, 경기 파주시 탄현면 방촌로 1017, 126.7336511125, 37.8249447589717, http://place.map.kakao.com/1410086979
1236720983, 할리스 광주운남점, 카페, 광주 광산구 하남대로 248-13, 126.820775200075, 35.1780170752187, http://place.map.kakao.com/1236720983
19336915, 할리스 광주풍암점, 카페, 광주 서구 풍금로38번길 11, 126.8635186245, 35.1234359316266, http://place.map.kakao.com/19336915
27588172, 할리스 광주수완2호점, 카페, 광주 광산구 수완로73번길 7, 126.82810371349366, 35.19128391905944, http://place.map.kakao.com/27588172
1646197107, 할리스 광주우산점, 카페, 광주 광산구 풍영철길로 12, 126.8124455622943, 35.16247228913589, http://place.map.kakao.com/1646197107
906299293, 할리스 광주금호점, 카페, 광주 서구 운천로 3, 126.859078601255, 35.1330682288005, http://place.map.kakao.com/906299293
1581437980, 할리스 광주아울렛점, 카페, 광주 서구 상무대로 633, 126.83421195745863, 35.14038646793763, http://place.map.kakao.com/1581437980
1718354762, 할리스 유스퀘어CGV점, 카페, 광주 서구 무진대로 904, 126.879310246104, 35.1604481718849, http://place.map.kakao.com/1718354762
1218447747, 할리스커피 상무점, 카페, 광주 서구 상무대로 633, 126.834207553618, 35.140393672803, http://place.map.kakao.com/1218447747
21657839, 할리스 광주첨단점, 카페, 광주 광산구 첨단중앙로 136, 126.842827028815, 35.2173250495386, http://place.map.kakao.com/21657839
1712603967, 할리스 백양사휴게소순천방향점, 카페, 전남 장성군 북이면 호남고속도로 107, 126.80536725844, 35.3944156224059, http://place.map.kakao.com/1712603967
2032490962, 할리스 화성조암점, 카페, 경기 화성시 우정읍 쌍봉로 76, 126.815224779303, 37.0870067049024, http://place.map.kakao.com/2032490962
1690820416, 할리스 화성휴게소목포방향점, 카페, 경기 화성시 팔탄면 서해안고속도로 301, 126.87918165423385, 37.143511047535185, http://place.map.kakao.com/1690820416
85244663, 할리스 화성휴게소시흥방향점, 카페, 경기 화성시 팔탄면 서해안고속도로 302, 126.881243650598, 37.1435374599854, http://place.map.kakao.com/85244663
1901609688, 할리스 매송휴게소목포방향점, 카페, 경기 화성시 매송면 서해안고속도로 315, 126.88858388523548, 37.26510174749271, http://place.map.kakao.com/1901609688
25071403, 할리스 안산중앙역점, 카페, 경기 안산시 단원구 광덕4로 234, 126.838589760645, 37.3145525383304, http://place.map.kakao.com/25071403
17073313, 할리스 안산로데오점, 카페, 경기 안산시 단원구 중앙대로 907, 126.837622472958, 37.3174056884199, http://place.map.kakao.com/17073313
19336921, 할리스 안산선부점, 카페, 경기 안산시 단원구 선부광장1로 56, 126.810905081385, 37.3365003107013, http://place.map.kakao.com/19336921
1524848842, 할리스 시흥능곡점, 카페, 경기 시흥시 능곡번영길 25, 126.807234354209, 37.369572898425, http://place.map.kakao.com/1524848842
19336920, 할리스 안산한대앞점, 카페, 경기 안산시 상록구 중보로 31, 126.850523079209, 37.3064949465643, http://place.map.kakao.com/19336920
26026302, 할리스 안산NC고잔점, 카페, 경기 안산시 단원구 광덕대로 194, 126.830834266894, 37.3139290031121, http://place.map.kakao.com/26026302
2020092640, 할리스 시흥하늘휴게소점, 카페, 경기 시흥시 수도권제1순환고속도로 105, 126.85559095962564, 37.38379150861293, http://place.map.kakao.com/2020092640
26887407, 할리스 가산디지털단지점, 카페, 서울 금천구 가산디지털1로 186, 126.881556667445, 37.4814256172394, http://place.map.kakao.com/26887407
12508420, 할리스 역곡역점, 카페, 경기 부천시 부일로726번길 5, 126.810485220532, 37.485394736833, http://place.map.kakao.com/12508420
2116755011, 할리스 시흥은계점, 카페, 경기 시흥시 은계번영길 13, 126.802569370036, 37.437245281163, http://place.map.kakao.com/2116755011
53179316, 할리스 구로거리공원점, 카페, 서울 구로구 구로중앙로28길 52, 126.88862856217447, 37.49977519776067, http://place.map.kakao.com/53179316
1520682537, 할리스 광명GIDC점, 카페, 경기 광명시 일직로 43, 126.886806210896, 37.4228631174394, http://place.map.kakao.com/1520682537
835692943, 할리스 마곡나인스퀘어점, 카페, 서울 강서구 공항대로 206, 126.83039725023168, 37.558980975471925, http://place.map.kakao.com/835692943
487595223, 할리스 목동점, 카페, 서울 양천구 목동서로 159-1, 126.875029611055, 37.5282495207141, http://place.map.kakao.com/487595223
518680483, 할리스 구로역점, 카페, 서울 구로구 새말로 18-29, 126.883189157174, 37.5018332470838, http://place.map.kakao.com/518680483
27164282, 할리스 신정네거리역점, 카페, 서울 양천구 중앙로 252, 126.853647467227, 37.519067177705, http://place.map.kakao.com/27164282
1405852147, 할리스 목동예술인회관점, 카페, 서울 양천구 목동서로 225, 126.8706367429403, 37.52690770472403, http://place.map.kakao.com/1405852147
1917319092, 할리스 목동삼성쉐르빌점, 카페, 서울 양천구 목동동로 189, 126.87007764025995, 37.52247956841407, http://place.map.kakao.com/1917319092
8146368, 할리스 김포공항점, 카페, 서울 강서구 하늘길 112, 126.80301489802517, 37.55895558494626, http://place.map.kakao.com/8146368
1847886904, 할리스 오목교역점, 카페, 서울 양천구 오목로 344, 126.87539876683, 37.523961143249, http://place.map.kakao.com/1847886904
2028961789, 할리스 고양덕은점, 카페, , 126.864630793311, 37.5818942356751, http://place.map.kakao.com/2028961789
27145948, 할리스 고양행신점, 카페, 경기 고양시 덕양구 충경로 37, 126.83358049145208, 37.615641670755416, http://place.map.kakao.com/27145948
948066992, 할리스 원흥역점, 카페, 경기 고양시 덕양구 권율대로 690, 126.875609263871, 37.6504606749698, http://place.map.kakao.com/948066992
12508518, 할리스 원당점, 카페, 경기 고양시 덕양구 호국로 797, 126.83675242732673, 37.65734365484025, http://place.map.kakao.com/12508518
1741231053, 할리스 화정역점, 카페, 경기 고양시 덕양구 화신로272번길 67, 126.8315688402765, 37.63374863622217, http://place.map.kakao.com/1741231053
2079389140, 할리스 덕양구청점, 카페, 경기 고양시 덕양구 화중로104번길 8, 126.831750459026, 37.636104969773, http://place.map.kakao.com/2079389140
1253111827, 할리스 커피클럽로스팅센터, 카페, 경기 파주시 문산읍 돈유3로 87, 126.81452038069, 37.8639020754347, http://place.map.kakao.com/1253111827
1613659552, 할리스 전남장흥점, 카페, 전남 장흥군 장흥읍 북부로 18, 126.90470746780069, 34.68392873065848, http://place.map.kakao.com/1613659552
436458430, 할리스 광주전남대점, 카페, 광주 북구 우치로 90, 126.91270457926369, 35.175376285465795, http://place.map.kakao.com/436458430
600162182, 할리스 광주북구청점, 카페, 광주 북구 서방로 2, 126.91324238834, 35.1734063051328, http://place.map.kakao.com/600162182
1716673322, 할리스 광주오치점, 카페, 광주 북구 서하로 185, 126.900662678719, 35.1874037166553, http://place.map.kakao.com/1716673322
8153561, 할리스 광주충장로점, 카페, 광주 동구 충장로안길 43, 126.917480321435, 35.1467218196691, http://place.map.kakao.com/8153561
21652454, 할리스 광주봉선점, 카페, 광주 남구 봉선중앙로 21, 126.912593453827, 35.1232685330587, http://place.map.kakao.com/21652454
27588292, 할리스 광주조선대점, 카페, 광주 동구 필문대로273번길 12, 126.928753126679, 35.1462963186101, http://place.map.kakao.com/27588292
1110128236, 할리스 광주일곡점, 카페, 광주 북구 송해로 81, 126.89888999764591, 35.20561500305231, http://place.map.kakao.com/1110128236
922598102, 할리스 전북김제점, 카페, 전북 김제시 검산택지5길 21-10, 126.90332450806446, 35.80160844791855, http://place.map.kakao.com/922598102
20847551, 할리스 익산모현점, 카페, 전북 익산시 선화로3길 16-10, 126.9388698723322, 35.949931040152855, http://place.map.kakao.com/20847551
1095467613, 할리스 익산어양점, 카페, 전북 익산시 동서로63길 4, 126.98781165669, 35.9528335646354, http://place.map.kakao.com/1095467613
1594540554, 할리스 익산영등점, 카페, 전북 익산시 고봉로32길 46-1, 126.97623315362, 35.9595622933137, http://place.map.kakao.com/1594540554
2142935185, 할리스 익산부송점, 카페, 전북 익산시 하나로10길 70-1, 126.989043051672, 35.9614062804641, http://place.map.kakao.com/2142935185
27588071, 할리스 수원오목천점, 카페, 경기 수원시 권선구 서수원로 179, 126.96888911156208, 37.24285916567887, http://place.map.kakao.com/27588071
17180767, 할리스 수원성대역점, 카페, 경기 수원시 장안구 서부로2126번길 10, 126.97200639671337, 37.29798654300646, http://place.map.kakao.com/17180767
1045916223, 할리스 화성융건릉점, 카페, 경기 화성시 효행로 501-3, 126.988428417567, 37.2075172737054, http://place.map.kakao.com/1045916223
1452170076, 할리스 봉담원희캐슬점, 카페, 경기 화성시 봉담읍 동화길 51, 126.95521295981244, 37.219132014065764, http://place.map.kakao.com/1452170076
1714616869, 할리스 매송휴게소서울방향점, 카페, 경기 화성시 매송면 서해안고속도로 316, 126.89182566773945, 37.26469387886869, http://place.map.kakao.com/1714616869
27016565, 할리스 평촌점, 카페, 경기 안양시 동안구 관평로170번길 43, 126.963058720665, 37.3931039893029, http://place.map.kakao.com/27016565
1834473817, 할리스 범계로데오점, 카페, 경기 안양시 동안구 평촌대로223번길 11, 126.954897507322, 37.3909639326268, http://place.map.kakao.com/1834473817
26874625, 할리스 평촌스마트스퀘어점, 카페, 경기 안양시 동안구 시민대로 311, 126.964606649985, 37.3961967708682, http://place.map.kakao.com/26874625
8147627, 할리스 산본점, 카페, 경기 군포시 번영로 505, 126.93347003799, 37.3588196600999, http://place.map.kakao.com/8147627
1525181748, 할리스 금정AK프라자점, 카페, 경기 군포시 엘에스로 143, 126.94414122407268, 37.37285686652738, http://place.map.kakao.com/1525181748
17100709, 할리스 신림점, 카페, 서울 관악구 신림로 353-1, 126.929287012108, 37.4859400339698, http://place.map.kakao.com/17100709
16679700, 할리스 서울대사거리점, 카페, 서울 관악구 관악로 172, 126.952871947708, 37.480545744145, http://place.map.kakao.com/16679700
21074939, 할리스 신림역점, 카페, 서울 관악구 신림로 313, 126.92971564173162, 37.482211917043436, http://place.map.kakao.com/21074939
8597100, 할리스 이수역점, 카페, 서울 동작구 동작대로 83, 126.98169695241295, 37.48401810439136, http://place.map.kakao.com/8597100
13500050, 할리스 구로디지털역점, 카페, 서울 구로구 디지털로32나길 38, 126.90125689692, 37.4845720245985, http://place.map.kakao.com/13500050
1621464669, 할리스 난곡사거리점, 카페, 서울 관악구 남부순환로 1489, 126.916188552952, 37.4824427642108, http://place.map.kakao.com/1621464669
26791912, 할리스 낙성대역점, 카페, 서울 관악구 남부순환로 1922, 126.96270086946, 37.4770821719387, http://place.map.kakao.com/26791912
12508590, 할리스 구로디지털점, 카페, 서울 구로구 디지털로31길 12, 126.89531135416766, 37.48494172538784, http://place.map.kakao.com/12508590
333196100, 할리스 구로디지털뉴스테이점, 카페, 서울 영등포구 시흥대로 595, 126.90356379434957, 37.48606329634312, http://place.map.kakao.com/333196100
23393478, 할리스 대림역점, 카페, 서울 영등포구 도림로 140, 126.897654281857, 37.4930960933714, http://place.map.kakao.com/23393478
10922544, 할리스 구로점, 카페, 서울 구로구 디지털로34길 55, 126.89910503388298, 37.483888143404336, http://place.map.kakao.com/10922544
1354396536, 할리스 시흥사거리점, 카페, 서울 금천구 시흥대로 225, 126.900451989451, 37.4537892270967, http://place.map.kakao.com/1354396536
1696797439, 할리스 보라매병원점, 카페, 서울 동작구 보라매로5길 20, 126.9242648745559, 37.49342249171586, http://place.map.kakao.com/1696797439
26779722, 할리스 서울대예술문화점, 카페, 서울 관악구 관악로 1, 126.95305769170463, 37.46194896255619, http://place.map.kakao.com/26779722
21458966, 할리스 합정역점, 카페, 서울 마포구 양화로 36, 126.913389616985, 37.5485599854878, http://place.map.kakao.com/21458966
1351592, 할리스 당산역점, 카페, 서울 영등포구 당산로 219, 126.90124112178198, 37.533465015020006, http://place.map.kakao.com/1351592
228226874, 할리스 여의도파이낸스타워점, 카페, 서울 영등포구 국제금융로2길 32, 126.92417092435299, 37.523704295395675, http://place.map.kakao.com/228226874
1306584702, 할리스 선유도역점TS카페, 카페, 서울 영등포구 양평로 96, 126.8967801678662, 37.536632721616535, http://place.map.kakao.com/1306584702
27548357, 할리스 보라매역점, 카페, 서울 영등포구 여의대방로 145, 126.920122352664, 37.5001809153915, http://place.map.kakao.com/27548357
1431390532, 할리스 여의도하나증권점, 카페, 서울 영등포구 의사당대로 82, 126.921854051951, 37.522681949477, http://place.map.kakao.com/1431390532
287398890, 할리스 장승배기역점, 카페, 서울 동작구 장승배기로11가길 11, 126.93908538637214, 37.50559644690577, http://place.map.kakao.com/287398890
33382441, 할리스 대방역점, 카페, 서울 동작구 알마타길 6, 126.92476576685112, 37.510379737752615, http://place.map.kakao.com/33382441
657788539, 할리스 전경련회관점, 카페, 서울 영등포구 여의대로 24, 126.9199121931162, 37.522235553470075, http://place.map.kakao.com/657788539
669270382, 할리스 공덕경의선숲길점, 카페, 서울 마포구 백범로28길 22, 126.946497083668, 37.5446629859114, http://place.map.kakao.com/669270382
1190557324, 할리스 공덕점, 카페, 서울 마포구 마포대로 143, 126.95329824248977, 37.547616643294226, http://place.map.kakao.com/1190557324
24870546, 할리스 용산더프라임점, 카페, 서울 용산구 원효로90길 11, 126.969580619467, 37.5403274695944, http://place.map.kakao.com/24870546
17148192, 할리스 노량진역점, 카페, 서울 동작구 노량진로 157, 126.94338588322, 37.5139076499498, http://place.map.kakao.com/17148192
8597788, 할리스 중앙대점, 카페, 서울 동작구 흑석로 77, 126.95825475380488, 37.50694727423267, http://place.map.kakao.com/8597788
1175134973, 할리스 공덕역북카페점, 카페, , 126.951365187822, 37.5445272383808, http://place.map.kakao.com/1175134973
995706649, 할리스 용산아이파크몰영풍문고점, 카페, 서울 용산구 한강대로23길 55, 126.96474274711633, 37.52977360382622, http://place.map.kakao.com/995706649
762459848, 할리스 숙대입구점, 카페, 서울 용산구 청파로 276, 126.970941414127, 37.5442886066432, http://place.map.kakao.com/762459848
1301209629, 할리스 홍대입구역점, 카페, 서울 마포구 양화로 151, 126.9224290754552, 37.55619862304326, http://place.map.kakao.com/1301209629
1862778678, 할리스 홍대역점, 카페, 서울 마포구 어울마당로 111, 126.92275981438439, 37.55484103675499, http://place.map.kakao.com/1862778678
1482644032, 할리스 홍대역2번출구점, 카페, 서울 마포구 동교로 200, 126.923121230348, 37.5577605038959, http://place.map.kakao.com/1482644032
21325305, 할리스 신촌점, 카페, 서울 서대문구 연세로 34, 126.937072945374, 37.5586229091958, http://place.map.kakao.com/21325305
101900827, 할리스 신촌연세로점, 카페, 서울 서대문구 연세로 5, 126.93653979605108, 37.55604847480273, http://place.map.kakao.com/101900827
