1197233818, 빽다방 용인동백역점, 카페, 경기 용인시 기흥구 동백중앙로 175, 127.15426971724435, 37.270020200449906, http://place.map.kakao.com/1197233818
353636356, 빽다방 용인동백쥬네브점, 카페, 경기 용인시 기흥구 동백중앙로 283, 127.1529741604196, 37.277761813452976, http://place.map.kakao.com/353636356
1338721695, 빽다방 힐스테이트동탄역점, 카페, 경기 화성시 동탄기흥로 585, 127.09293347025097, 37.213303069052415, http://place.map.kakao.com/1338721695
1145337979, 빽다방 용인구성언남점, 카페, 경기 용인시 기흥구 구성로 102, 127.12044636341192, 37.29339905499053, http://place.map.kakao.com/1145337979
595427448, 빽다방 동탄역아이비파크점, 카페, 경기 화성시 동탄광역환승로 73, 127.09048615540716, 37.20170123570768, http://place.map.kakao.com/595427448
739510888, 빽다방 동탄서영아너시티점, 카페, 경기 화성시 동탄영천로 101, 127.102861248468, 37.2117585744248, http://place.map.kakao.com/739510888
27398453, 빽다방 용인강남대점, 카페, 경기 용인시 기흥구 강남로 3, 127.12638169882197, 37.27099394260311, http://place.map.kakao.com/27398453
1577433720, 빽다방 동탄역시범단지점, 카페, 경기 화성시 동탄대로시범길 253, 127.102752553825, 37.2022183463374, http://place.map.kakao.com/1577433720
448096845, 빽다방 기흥역점, 카페, 경기 용인시 기흥구 기흥역로58번길 10, 127.11876003656168, 37.273850022220245, http://place.map.kakao.com/448096845
778970509, 빽다방 분당미금역천사점, 카페, 경기 성남시 분당구 성남대로 165, 127.1084813138479, 37.35051358568619, http://place.map.kakao.com/778970509
27095242, 빽다방 분당서현대명점, 카페, 경기 성남시 분당구 황새울로360번길 12, 127.12505991703952, 37.3864832845816, http://place.map.kakao.com/27095242
27222123, 빽다방 수내역초림점, 카페, 경기 성남시 분당구 백현로101번길 17, 127.11250795672568, 37.377479348245025, http://place.map.kakao.com/27222123
1495147237, 빽다방 용인구성역점, 카페, 경기 용인시 기흥구 용구대로 2398, 127.1071369744544, 37.3003642499126, http://place.map.kakao.com/1495147237
27095269, 빽다방 분당정자카페점, 카페, 경기 성남시 분당구 정자일로 230, 127.10614582378514, 37.370327486941555, http://place.map.kakao.com/27095269
1785958932, 빽다방 판교역점, 카페, 경기 성남시 분당구 대왕판교로606번길 31, 127.110969114236, 37.396672590654, http://place.map.kakao.com/1785958932
27393422, 빽다방 미금역농협점, 카페, 경기 성남시 분당구 돌마로90번길 4, 127.11172287401077, 37.349805063332454, http://place.map.kakao.com/27393422
27394647, 빽다방 수지구청점, 카페, 경기 용인시 수지구 풍덕천로 144-1, 127.0974696564157, 37.323887804005565, http://place.map.kakao.com/27394647
27393488, 빽다방 분당서현교보점, 카페, 경기 성남시 분당구 분당로53번길 9, 127.12135185676652, 37.38380119781202, http://place.map.kakao.com/27393488
2049640729, 빽다방 분당정자역점, 카페, 경기 성남시 분당구 성남대로331번길 13, 127.106486705427, 37.3654922755639, http://place.map.kakao.com/2049640729
709787468, 빽다방 용인죽전점, 카페, 경기 용인시 수지구 현암로 154, 127.12649088121422, 37.33149928767066, http://place.map.kakao.com/709787468
1562689376, 빽다방 용인동천점, 카페, 경기 용인시 수지구 문인로54번길 2, 127.097352334386, 37.3335199321309, http://place.map.kakao.com/1562689376
27095912, 빽다방 용인죽전누리점, 카페, 경기 용인시 기흥구 죽전로 20, 127.11061185709771, 37.32026400783907, http://place.map.kakao.com/27095912
2119724296, 빽다방 용인마북점, 카페, 경기 용인시 기흥구 마북로 159, 127.123525819781, 37.3040956873971, http://place.map.kakao.com/2119724296
2127761988, 빽다방 분당수내역1번출구점, 카페, 경기 성남시 분당구 황새울로258번길 32, 127.11625961293, 37.3795516795451, http://place.map.kakao.com/2127761988
27095522, 빽다방 모란역점, 카페, 경기 성남시 중원구 성남대로 1141, 127.12878228107215, 37.43168073076326, http://place.map.kakao.com/27095522
27393042, 빽다방 단대오거리역점, 카페, 경기 성남시 중원구 산성대로 354, 127.15567594736528, 37.443961639554466, http://place.map.kakao.com/27393042
1605704405, 빽다방 야탑역대덕점, 카페, 경기 성남시 분당구 성남대로926번길 6, 127.12978783408045, 37.41202753915609, http://place.map.kakao.com/1605704405
26934443, 빽다방 가락시장역점, 카페, 서울 송파구 송파대로28길 27, 127.12081671226456, 37.49490048304697, http://place.map.kakao.com/26934443
27273782, 빽다방 분당야탑역NC점, 카페, 경기 성남시 분당구 야탑로75번길 15, 127.12682697802619, 37.41120992404753, http://place.map.kakao.com/27273782
763128264, 빽다방 성남을지대점, 카페, 경기 성남시 수정구 산성대로 535, 127.16441751942907, 37.458705685758645, http://place.map.kakao.com/763128264
27394639, 빽다방 수서역점, 카페, 서울 강남구 밤고개로1길 10, 127.10199930867952, 37.487821896748166, http://place.map.kakao.com/27394639
26924590, 빽다방 판교유스페이스점, 카페, 경기 성남시 분당구 대왕판교로 660, 127.10724178186788, 37.40107301312671, http://place.map.kakao.com/26924590
1468811013, 빽다방 문정법조현대점, 카페, 서울 송파구 법원로11길 11, 127.11831610467235, 37.48534783324296, http://place.map.kakao.com/1468811013
1264394832, 빽다방 송파하비오점, 카페, 서울 송파구 송파대로 111, 127.12395004309161, 37.481796590174696, http://place.map.kakao.com/1264394832
1586648006, 빽다방 성남수진푸르지오점, 카페, 경기 성남시 중원구 광명로 89, 127.13827641747142, 37.435292989753236, http://place.map.kakao.com/1586648006
1312968197, 빽다방 성남상대원금상점, 카페, 경기 성남시 중원구 금상로96번길 2, 127.16585622996553, 37.442268302669014, http://place.map.kakao.com/1312968197
27392984, 빽다방 거여역점, 카페, 서울 송파구 오금로 512, 127.1455457628567, 37.492730012122706, http://place.map.kakao.com/27392984
57282754, 빽다방 위례역점, 카페, 경기 성남시 수정구 위례서일로 34, 127.139490874259, 37.4643951866618, http://place.map.kakao.com/57282754
891970046, 빽다방 신구대점, 카페, 경기 성남시 중원구 금빛로 48, 127.167761386846, 37.4462877387658, http://place.map.kakao.com/891970046
759679050, 빽다방 산성역점, 카페, 경기 성남시 수정구 수정로 346, 127.149993258752, 37.4543198260936, http://place.map.kakao.com/759679050
27095176, 빽다방 동서울대점, 카페, 경기 성남시 수정구 복정로72번길 4, 127.12681408991214, 37.45915387108647, http://place.map.kakao.com/27095176
26808553, 빽다방 성남수진점, 카페, 경기 성남시 수정구 수정로 106, 127.13210172032355, 37.44061874315395, http://place.map.kakao.com/26808553
2072028934, 빽다방 성남상대원센터M점, 카페, 경기 성남시 중원구 사기막골로62번길 33, 127.175238256922, 37.4347529191116, http://place.map.kakao.com/2072028934
354226032, 빽다방 문정역점, 카페, 서울 송파구 법원로 114, 127.12101051106, 37.4860541974218, http://place.map.kakao.com/354226032
1263484211, 빽다방 성남도촌점, 카페, 경기 성남시 중원구 도촌남로 27, 127.150608551544, 37.4145121862968, http://place.map.kakao.com/1263484211
27597042, 빽다방 성남가천대역점, 카페, 경기 성남시 수정구 성남대로 1330, 127.12704898405488, 37.448342368437835, http://place.map.kakao.com/27597042
807823486, 빽다방 성남상대원시장점, 카페, 경기 성남시 중원구 희망로 338, 127.158384683326, 37.4359209923309, http://place.map.kakao.com/807823486
1476902982, 빽다방 위례센터점, 카페, 경기 성남시 수정구 위례광장로 300, 127.14269120919911, 37.473468141793305, http://place.map.kakao.com/1476902982
1572264220, 빽다방 개롱역점, 카페, 서울 송파구 오금로 396, 127.134256336973, 37.4979728208896, http://place.map.kakao.com/1572264220
775005620, 빽다방 성남의료원점, 카페, 경기 성남시 수정구 수정로 176-1, 127.13960027073637, 37.44297799029502, http://place.map.kakao.com/775005620
1910311964, 빽다방 성남신흥역점, 카페, 경기 성남시 수정구 산성대로 267, 127.14640286949968, 37.44112448288102, http://place.map.kakao.com/1910311964
27094292, 빽다방 구리돌다리점, 카페, 경기 구리시 검배로6번길 27, 127.14022892928702, 37.59971918518678, http://place.map.kakao.com/27094292
27398707, 빽다방 천호역로데오점, 카페, 서울 강동구 올림픽로70길 57, 127.12675369753909, 37.53914972504701, http://place.map.kakao.com/27398707
27393432, 빽다방 명일역점, 카페, 서울 강동구 구천면로 418, 127.1452041716442, 37.55047024898422, http://place.map.kakao.com/27393432
26938366, 빽다방 천호역롯데점, 카페, 서울 강동구 천호옛길 94, 127.1260869428392, 37.53695019747344, http://place.map.kakao.com/26938366
26808915, 빽다방 잠실장미상가점, 카페, 서울 송파구 올림픽로35길 124, 127.10070226975878, 37.5172102007876, http://place.map.kakao.com/26808915
1799117127, 빽다방 방이시장점, 카페, 서울 송파구 백제고분로48길 6, 127.113871644306, 37.5115597589193, http://place.map.kakao.com/1799117127
27394675, 빽다방 오금역점, 카페, 서울 송파구 오금로 306, 127.12630883981893, 37.5028037670269, http://place.map.kakao.com/27394675
1964605375, 빽다방 강변역점, 카페, 서울 광진구 강변역로4길 10, 127.093406308301, 37.5353497579991, http://place.map.kakao.com/1964605375
27207665, 빽다방 강동역헤르셔점, 카페, 서울 강동구 천호대로 1089, 127.13306643310548, 37.5360631633253, http://place.map.kakao.com/27207665
27393201, 빽다방 둔촌동역점, 카페, 서울 강동구 양재대로 1339, 127.13519570045695, 37.52597764573509, http://place.map.kakao.com/27393201
52534174, 빽다방 석촌역점, 카페, 서울 송파구 백제고분로 385, 127.10829916940483, 37.506292322127045, http://place.map.kakao.com/52534174
2037278186, 빽다방 다산테라타워점, 카페, 경기 남양주시 다산지금로 202, 127.17261606149994, 37.595976795878485, http://place.map.kakao.com/2037278186
26877039, 빽다방 송파역점, 카페, 서울 송파구 송파대로 366, 127.11170756263095, 37.50070201520135, http://place.map.kakao.com/26877039
1270702405, 빽다방 송파사거리점, 카페, 서울 송파구 가락로 113, 127.108727863051, 37.5016463460482, http://place.map.kakao.com/1270702405
675882037, 빽다방 망우역사거리점, 카페, 서울 중랑구 용마산로115길 127, 127.09355603537998, 37.5971957847736, http://place.map.kakao.com/675882037
1198587747, 빽다방 구리수택점, 카페, 경기 구리시 체육관로80번길 9, 127.138587215051, 37.5919275540421, http://place.map.kakao.com/1198587747
616447650, 빽다방 석촌고분역점, 카페, 서울 송파구 백제고분로 257, 127.095139013844, 37.5027681104015, http://place.map.kakao.com/616447650
936853846, 빽다방 미사스마트밸리점, 카페, 경기 하남시 미사강변서로 16, 127.18415691500425, 37.55183949776946, http://place.map.kakao.com/936853846
2033561483, 빽다방 굽은다리역점, 카페, 서울 강동구 양재대로 1576, 127.143431634798, 37.5461476250121, http://place.map.kakao.com/2033561483
765158991, 빽다방 방이역코오롱점, 카페, 서울 송파구 마천로 25, 127.1239248245438, 37.50964671915352, http://place.map.kakao.com/765158991
27095655, 빽다방 아차산점, 카페, 서울 광진구 천호대로129길 17, 127.09065764926223, 37.552760103564886, http://place.map.kakao.com/27095655
279768799, 빽다방 고덕역점, 카페, 서울 강동구 동남로75길 13-7, 127.15554224152893, 37.553920516887665, http://place.map.kakao.com/279768799
1890642887, 빽다방 강동구청점, 카페, 서울 강동구 성내로3길 1, 127.121910634008, 37.5306241536575, http://place.map.kakao.com/1890642887
1536994564, 빽다방 올림픽북단점, 카페, 서울 광진구 아차산로 480, 127.095234544458, 37.5405668897913, http://place.map.kakao.com/1536994564
1043864085, 빽다방 미사센트럴자이점, 카페, 경기 하남시 미사강변대로 84, 127.1879982338, 37.5574070086111, http://place.map.kakao.com/1043864085
213856184, 빽다방 암사역점, 카페, 서울 강동구 올림픽로 770, 127.127658915299, 37.5497841391195, http://place.map.kakao.com/213856184
239728581, 빽다방 미사강변점, 카페, 경기 하남시 미사강변대로226번길 14, 127.18465799832654, 37.56962346779567, http://place.map.kakao.com/239728581
545184270, 빽다방 서일대점, 카페, 서울 중랑구 용마산로 388, 127.09534367515, 37.5862590171035, http://place.map.kakao.com/545184270
327792603, 빽다방 잠실레이크팰리스점, 카페, 서울 송파구 석촌호수로 144, 127.09307010409427, 37.506981056233904, http://place.map.kakao.com/327792603
3352258, 빽다방 잠실역지하도점, 카페, 서울 송파구 올림픽로 지하 265, 127.10186167408933, 37.51385927604304, http://place.map.kakao.com/3352258
1238313083, 빽다방 천호힐데스하임점, 카페, 서울 강동구 올림픽로78길 30, 127.125943763088, 37.5419653136158, http://place.map.kakao.com/1238313083
240078364, 빽다방 다산중앙점, 카페, 경기 남양주시 다산중앙로123번길 9, 127.152465932691, 37.6237009317226, http://place.map.kakao.com/240078364
767229102, 빽다방 봉화산역점, 카페, 서울 중랑구 신내로 211, 127.09226757376123, 37.616586993482315, http://place.map.kakao.com/767229102
87733210, 빽다방 별내파라곤스퀘어점, 카페, 경기 남양주시 순화궁로 249, 127.12817660682066, 37.65108460709351, http://place.map.kakao.com/87733210
917533407, 빽다방 남양주2청사점, 카페, 경기 남양주시 다산지금로16번길 43, 127.16897724859933, 37.609736565400084, http://place.map.kakao.com/917533407
993114447, 빽다방 별내로데오점, 카페, 경기 남양주시 별내중앙로 54, 127.123868784612, 37.6473149922218, http://place.map.kakao.com/993114447
934280832, 빽다방 별내북부점, 카페, 경기 남양주시 별내3로 322, 127.11753031989714, 37.66615920161123, http://place.map.kakao.com/934280832
801297999, 빽다방 다산롯데캐슬점, 카페, 경기 남양주시 다산중앙로146번길 22, 127.15482539346337, 37.625841305625826, http://place.map.kakao.com/801297999
1655826836, 빽다방 다산현대캠퍼스몰점, 카페, 경기 남양주시 다산순환로 20, 127.152330674882, 37.6118170840589, http://place.map.kakao.com/1655826836
485731471, 빽다방 구리갈매역중앙점, 카페, 경기 구리시 산마루로 11-12, 127.11655638967613, 37.63259495513048, http://place.map.kakao.com/485731471
27094261, 빽다방 구리인창늘푸른점, 카페, 경기 구리시 건원대로34번길 35, 127.14218716986122, 37.60464525637716, http://place.map.kakao.com/27094261
1350691613, 빽다방 남양주사능점, 카페, 경기 남양주시 진건읍 사릉로442번길 25, 127.17771356797408, 37.65912471009353, http://place.map.kakao.com/1350691613
812089811, 빽다방 다산새봄점, 카페, 경기 남양주시 다산순환로 418, 127.15774886838074, 37.6203486242251, http://place.map.kakao.com/812089811
1051088256, 빽다방 구리인창점, 카페, 경기 구리시 건원대로 91, 127.138224881375, 37.6090648101496, http://place.map.kakao.com/1051088256
27393027, 빽다방 남양주장현점, 카페, 경기 남양주시 진접읍 장현로 77, 127.18120918825342, 37.71758013051434, http://place.map.kakao.com/27393027
27394677, 빽다방 의정민락위드점, 카페, 경기 의정부시 오목로205번길 22, 127.09771897216426, 37.74528822786827, http://place.map.kakao.com/27394677
1229438429, 빽다방 진접롯데시네마점, 카페, 경기 남양주시 진접읍 해밀예당1로 36, 127.1866745011, 37.7120090023689, http://place.map.kakao.com/1229438429
27255484, 빽다방 포천송우중앙점, 카페, 경기 포천시 소흘읍 송우로 80, 127.14064373106532, 37.830300084703346, http://place.map.kakao.com/27255484
1270250087, 빽다방 양주옥정신도시점, 카페, 경기 양주시 옥정동로7다길 54, 127.09278338126126, 37.819749565240535, http://place.map.kakao.com/1270250087
542602573, 빽다방 계룡시청점, 카페, 충남 계룡시 장안로 59-3, 127.250550373823, 36.2724784647858, http://place.map.kakao.com/542602573
1982294194, 빽다방 충남계룡엄사점, 카페, 충남 계룡시 엄사면 번영로 26, 127.242569153535, 36.2885414906039, http://place.map.kakao.com/1982294194
1705544136, 빽다방 세종어반아트리움점, 카페, 세종특별자치시 나성북로 30, 127.26040230184462, 36.489506862349785, http://place.map.kakao.com/1705544136
246234231, 빽다방 세종새롬중앙점, 카페, 세종특별자치시 새롬중앙로 47, 127.250784373122, 36.4850072578418, http://place.map.kakao.com/246234231
687356479, 빽다방 세종시청점, 카페, 세종특별자치시 한누리대로 2143, 127.28821363414212, 36.47803517494849, http://place.map.kakao.com/687356479
599984369, 빽다방 세종첫마을점, 카페, 세종특별자치시 한누리대로 201, 127.26005641043754, 36.48251823786738, http://place.map.kakao.com/599984369
1976363616, 빽다방 세종다정점, 카페, 세종특별자치시 다정중앙로 53, 127.24859192317342, 36.49526701533798, http://place.map.kakao.com/1976363616
405511807, 빽다방 세종대평점, 카페, 세종특별자치시 한누리대로 2236, 127.27763221809391, 36.4737437110766, http://place.map.kakao.com/405511807
27393521, 빽다방 세종도담센트럴점, 카페, 세종특별자치시 한누리대로 583, 127.25866421686914, 36.515216095615735, http://place.map.kakao.com/27393521
1723188198, 빽다방 조치원신흥점, 카페, 세종특별자치시 조치원읍 대첩로 68, 127.288649862787, 36.5951934532849, http://place.map.kakao.com/1723188198
1962078988, 빽다방 세종한뜰마을4단지점, 카페, 세종특별자치시 다솜1로 21, 127.256130173436, 36.5003615265384, http://place.map.kakao.com/1962078988
940090947, 빽다방 세종아름점, 카페, 세종특별자치시 보듬3로 92, 127.24924204326344, 36.51180366000262, http://place.map.kakao.com/940090947
27597049, 빽다방 세종시정부청사점, 카페, 세종특별자치시 도움8로 11-11, 127.262895221294, 36.5075821840103, http://place.map.kakao.com/27597049
1118688457, 빽다방 세종다온주유소점, 카페, 세종특별자치시 세종로 1328, 127.244262506632, 36.5204866606624, http://place.map.kakao.com/1118688457
813582375, 빽다방 세종종촌점, 카페, 세종특별자치시 도움3로 105-7, 127.249737745371, 36.504519492358, http://place.map.kakao.com/813582375
2034403024, 빽다방 세종고운남측점, 카페, 세종특별자치시 마음로 70, 127.234395429332, 36.5050426532437, http://place.map.kakao.com/2034403024
720267081, 빽다방 세종고운하모니점, 카페, 세종특별자치시 마음로 272-28, 127.23543876591492, 36.51929866064924, http://place.map.kakao.com/720267081
1412350701, 빽다방 천안목천점, 카페, 충남 천안시 동남구 목천읍 충절로 896, 127.209918973912, 36.7732039634359, http://place.map.kakao.com/1412350701
696771896, 빽다방 천안성거점, 카페, 충남 천안시 서북구 성거읍 성거길 107, 127.20180074965637, 36.874973779051786, http://place.map.kakao.com/696771896
578916762, 빽다방 천안입장점, 카페, 충남 천안시 서북구 입장면 하장4길 2, 127.222019892817, 36.9144273806699, http://place.map.kakao.com/578916762
27095704, 빽다방 안성중앙로점, 카페, 경기 안성시 중앙로379번길 4, 127.26916598616826, 37.007772487005155, http://place.map.kakao.com/27095704
1044228280, 빽다방 안성아양점, 카페, 경기 안성시 아양1로 77-10, 127.258353030994, 37.0078253508112, http://place.map.kakao.com/1044228280
27095898, 빽다방 용인처인중앙점, 카페, 경기 용인시 처인구 금령로90번길 3-4, 127.20637714833722, 37.23498939965648, http://place.map.kakao.com/27095898
2078123684, 빽다방 용인둔전점, 카페, 경기 용인시 처인구 포곡읍 포곡로118번길 3, 127.218741899114, 37.2697402264437, http://place.map.kakao.com/2078123684
1822040514, 빽다방 광주태전점, 카페, 경기 광주시 고불로 56, 127.23179783694854, 37.39319522488979, http://place.map.kakao.com/1822040514
1939429747, 빽다방 태전한아람초점, 카페, 경기 광주시 태봉로 145-1, 127.2311273650774, 37.380793977002, http://place.map.kakao.com/1939429747
350188125, 빽다방 경기광주경안점, 카페, 경기 광주시 중앙로 110, 127.25855269176972, 37.4095698294945, http://place.map.kakao.com/350188125
27094529, 빽다방 광주이마트점, 카페, 경기 광주시 광주대로 30, 127.261158793569, 37.4099731635716, http://place.map.kakao.com/27094529
1829132512, 빽다방 하남미사역점, 카페, 경기 하남시 미사강변동로 85, 127.19188086899027, 37.562531932790755, http://place.map.kakao.com/1829132512
1297267658, 빽다방 하남풍산점, 카페, 경기 하남시 덕풍동로 111-21, 127.20775517435439, 37.55202828682473, http://place.map.kakao.com/1297267658
1995555843, 빽다방 남양주덕소점, 카페, 경기 남양주시 와부읍 덕소로 88, 127.21205903757146, 37.586394455540805, http://place.map.kakao.com/1995555843
27094332, 빽다방 평내호평역점, 카페, 경기 남양주시 늘을2로 32, 127.24395020871404, 37.65553304715795, http://place.map.kakao.com/27094332
875810971, 빽다방 포천신읍점, 카페, 경기 포천시 중앙로 103, 127.20194058294, 37.8958622009121, http://place.map.kakao.com/875810971
206985531, 빽다방 철원동송점, 카페, 강원 철원군 동송읍 금학로218번길 2, 127.21844705503557, 38.20813120995642, http://place.map.kakao.com/206985531
1442715186, 빽다방 남원중앙점, 카페, 전북 남원시 남문로 447, 127.38034499688939, 35.406494775811325, http://place.map.kakao.com/1442715186
631319019, 빽다방 서대전샘물타운점, 카페, 대전 유성구 원내로 38, 127.31972450330265, 36.29974475766505, http://place.map.kakao.com/631319019
227631470, 빽다방 대전관저더샵점, 카페, 대전 서구 관저로 23, 127.325956950331, 36.2962899102733, http://place.map.kakao.com/227631470
2116047983, 빽다방 대전관저중앙점, 카페, 대전 서구 관저로 157, 127.33967852471113, 36.2992418446878, http://place.map.kakao.com/2116047983
26890371, 빽다방 대전을지병원점, 카페, 대전 서구 대덕대로 238, 127.3800265838261, 36.35419052727352, http://place.map.kakao.com/26890371
1754435382, 빽다방 대전봉명우산점, 카페, 대전 유성구 문화원로 86, 127.3455462223199, 36.35889390877713, http://place.map.kakao.com/1754435382
27393182, 빽다방 대전타임월드점, 카페, 대전 서구 둔산로31번길 35, 127.37733930826002, 36.35324830440701, http://place.map.kakao.com/27393182
2127064302, 빽다방 대전만년점, 카페, 대전 서구 둔산대로117번길 82, 127.382553024585, 36.3686958604532, http://place.map.kakao.com/2127064302
2139493765, 빽다방 대전맑은아침점, 카페, 대전 서구 도산로253번길 51, 127.38057610616498, 36.33158277623901, http://place.map.kakao.com/2139493765
27095076, 빽다방 대전스타게이트점, 카페, 대전 서구 대덕대로 325, 127.37911644962588, 36.36178761046106, http://place.map.kakao.com/27095076
27393110, 빽다방 대전유성리베라점, 카페, 대전 유성구 계룡로 64, 127.33786201169934, 36.35454338158484, http://place.map.kakao.com/27393110
26625305, 빽다방 대전법원점, 카페, 대전 서구 둔산로137번길 27, 127.38907040262525, 36.35255102404555, http://place.map.kakao.com/26625305
273334445, 빽다방 대전갈마점, 카페, 대전 서구 신갈마로 110-1, 127.368787973799, 36.3438667289639, http://place.map.kakao.com/273334445
27393163, 빽다방 대전노은CGV점, 카페, 대전 유성구 은구비남로33번길 5, 127.31915725112916, 36.372504752083735, http://place.map.kakao.com/27393163
1232276256, 빽다방 대전아이파크시티점, 카페, 대전 유성구 상대복용로29번길 52, 127.33230307740108, 36.33628670282416, http://place.map.kakao.com/1232276256
27393176, 빽다방 대전둔산중앙점, 카페, 대전 서구 대덕대로185번길 22, 127.376395836476, 36.350271094687145, http://place.map.kakao.com/27393176
1055615054, 빽다방 대전유성센트럴점, 카페, 대전 유성구 계룡로132번길 10, 127.34455760857796, 36.35224068328927, http://place.map.kakao.com/1055615054
27095070, 빽다방 대전롯데점, 카페, 대전 서구 도솔로 382, 127.38811060595691, 36.340536071538615, http://place.map.kakao.com/27095070
1855329672, 빽다방 대전복수점, 카페, 대전 서구 복수동로 40, 127.378367350275, 36.3006748028647, http://place.map.kakao.com/1855329672
355477861, 빽다방 대전탄방로데오점, 카페, 대전 서구 둔산중로14번길 36, 127.38860348879786, 36.34759518110704, http://place.map.kakao.com/355477861
312437395, 빽다방 대전월평역점, 카페, 대전 서구 월평중로 20, 127.364174327841, 36.356371169855, http://place.map.kakao.com/312437395
99735670, 빽다방 대전건양대병원점, 카페, 대전 서구 관저동로 170, 127.341154231655, 36.307297825844, http://place.map.kakao.com/99735670
2125110419, 빽다방 대전정부청사점, 카페, 대전 서구 둔산중로134번길 29, 127.38860828789969, 36.35887155918386, http://place.map.kakao.com/2125110419
