id, store, business, location, x, y, url
1144286, 빽다방 제주동광육거리점, 카페, 제주특별자치도 서귀포시 안덕면 신화역사로 502, 126.34124192669007, 33.31001403848381, http://place.map.kakao.com/1144286
883505421, 빽다방 제주애월좋은마트점, 카페, 제주특별자치도 제주시 애월읍 일주서로 6679, 126.3658602565048, 33.47099178352053, http://place.map.kakao.com/883505421
875822301, 빽다방 목포역점, 카페, 전남 목포시 수문로 9, 126.384786502493, 34.7914724661535, http://place.map.kakao.com/875822301
2139401247, 빽다방 목포여객터미널점, 카페, 전남 목포시 해안로 189-1, 126.384432887613, 34.782889380978, http://place.map.kakao.com/2139401247
1018681263, 빽다방 목포북항골든점, 카페, 전남 목포시 원산중앙로 10, 126.3741631349695, 34.80703316134788, http://place.map.kakao.com/1018681263
1665306630, 빽다방 태안터미널점, 카페, 충남 태안군 태안읍 동백로 307, 126.303894604041, 36.7482754711579, http://place.map.kakao.com/1665306630
1098530020, 빽다방 호텔더본제주점, 카페, 제주특별자치도 서귀포시 색달로 18, 126.40641962965674, 33.25955535780345, http://place.map.kakao.com/1098530020
281062454, 빽다방 서귀포하원점, 카페, 제주특별자치도 서귀포시 일주서로 443, 126.461383678083, 33.253652904825, http://place.map.kakao.com/281062454
937504268, 빽다방 빵연구소 제주연동점, 카페, 제주특별자치도 제주시 신광로10길 27, 126.48694516930144, 33.48378131129098, http://place.map.kakao.com/937504268
27166386, 빽다방 탐라도서관점, 카페, 제주특별자치도 제주시 노형6길 27, 126.47797926139972, 33.4800211956398, http://place.map.kakao.com/27166386
93488138, 빽다방 제주연북로점, 카페, 제주특별자치도 제주시 과원북4길 19, 126.48425396981834, 33.48128264729006, http://place.map.kakao.com/93488138
27222177, 빽다방 제주노형뜨란채점, 카페, 제주특별자치도 제주시 수덕로 35, 126.47331737221904, 33.48660112476012, http://place.map.kakao.com/27222177
673272555, 빽다방 제주평화로SK점, 카페, , 126.45679751416, 33.4669995340556, http://place.map.kakao.com/673272555
27524338, 빽다방 제주제원점, 카페, 제주특별자치도 제주시 신광로 56, 126.48983583727683, 33.48715347926886, http://place.map.kakao.com/27524338
1457492911, 빽다방 제주외도점, 카페, 제주특별자치도 제주시 우정로15길 1, 126.43102935389408, 33.486085109396384, http://place.map.kakao.com/1457492911
1808915729, 빽다방베이커리 제주사수점, 카페, 제주특별자치도 제주시 서해안로 291-5, 126.47665114830023, 33.509249662484564, http://place.map.kakao.com/1808915729
712720401, 빽다방 목포평화광장점, 카페, 전남 목포시 원형로 4-1, 126.43058135955589, 34.79864780743577, http://place.map.kakao.com/712720401
1884714537, 빽다방 삼호대불점, 카페, 전남 영암군 삼호읍 대불주거5로 6, 126.456205604732, 34.754615212853, http://place.map.kakao.com/1884714537
27539867, 빽다방 목포장미의거리점, 카페, 전남 목포시 비파로51번길 31, 126.42378640018454, 34.80167246385238, http://place.map.kakao.com/27539867
704969061, 빽다방 무안남악시장점, 카페, 전남 무안군 삼향읍 남악5로48번길 5, 126.47190793443788, 34.809944790429206, http://place.map.kakao.com/704969061
339283727, 빽다방 목포석현점, 카페, 전남 목포시 영산로 626, 126.422248140537, 34.8210343553838, http://place.map.kakao.com/339283727
1013653973, 빽다방 무안전남도청점, 카페, 전남 무안군 삼향읍 남악3로82번길 14, 126.46183911298341, 34.81263191229157, http://place.map.kakao.com/1013653973
601695830, 빽다방 목포용해점, 카페, 전남 목포시 연산백련로 13, 126.392044717616, 34.8175484261965, http://place.map.kakao.com/601695830
1871836249, 빽다방 목포용당점, 카페, 전남 목포시 영산로 257, 126.394206011518, 34.8035984170648, http://place.map.kakao.com/1871836249
2024322887, 빽다방 목포상동점, 카페, 전남 목포시 옥암로 182, 126.422215403697, 34.8146081588686, http://place.map.kakao.com/2024322887
1881471503, 빽다방 목포터미널점, 카페, 전남 목포시 영산로 515, 126.417699374252, 34.8116489851019, http://place.map.kakao.com/1881471503
967070141, 빽다방 목포옥암점, 카페, 전남 목포시 당가두로 18, 126.437914890487, 34.8079653901852, http://place.map.kakao.com/967070141
1096413463, 빽다방 목포용해이로점, 카페, 전남 목포시 송림로 77-3, 126.405849297908, 34.805656917366, http://place.map.kakao.com/1096413463
2078056002, 빽다방 무안오룡점, 카페, 전남 무안군 일로읍 오룡중앙동로 37, 126.48525750885663, 34.80522187157095, http://place.map.kakao.com/2078056002
1173487321, 빽다방 목포중흥S클래스점, 카페, 전남 목포시 비파로 96, 126.42482854014396, 34.806445781752956, http://place.map.kakao.com/1173487321
186685069, 빽다방 무안목포대점, 카페, 전남 무안군 청계면 도림길 87-23, 126.433499839795, 34.9093890456953, http://place.map.kakao.com/186685069
2034265887, 빽다방 전남무안읍점, 카페, 전남 무안군 무안읍 하마로 15, 126.471486423903, 34.9846188273136, http://place.map.kakao.com/2034265887
1827828887, 빽다방 서산터미널점, 카페, 충남 서산시 율지8로 4, 126.45976338013959, 36.78184402662426, http://place.map.kakao.com/1827828887
27392124, 빽다방 서산호수공원점, 카페, 충남 서산시 호수공원10로 7, 126.44804217325716, 36.77170595837999, http://place.map.kakao.com/27392124
2071826107, 빽다방 서산테크노밸리점, 카페, 충남 서산시 성연면 성연4로 27-28, 126.449973310845, 36.8234047779981, http://place.map.kakao.com/2071826107
1481885364, 빽다방 신서귀포점, 카페, 제주특별자치도 서귀포시 신중로 26-8, 126.50773353398249, 33.254654676332784, http://place.map.kakao.com/1481885364
200851450, 빽다방 서귀포올레중앙점, 카페, 제주특별자치도 서귀포시 중정로61번길 19, 126.562646790419, 33.2494952271889, http://place.map.kakao.com/200851450
778106572, 빽다방 서귀포동홍중앙점, 카페, 제주특별자치도 서귀포시 동홍북로48번길 17, 126.573626430268, 33.2574568802638, http://place.map.kakao.com/778106572
1225820130, 빽다방 서귀포시청점, 카페, 제주특별자치도 서귀포시 중앙로 109, 126.560544430483, 33.2544684194434, http://place.map.kakao.com/1225820130
39071171, 빽다방빵연구소 제주합동청사점, 카페, 제주특별자치도 제주시 청사로 75, 126.52703094185917, 33.49007431936802, http://place.map.kakao.com/39071171
26635265, 빽다방 제주중앙여고점, 카페, 제주특별자치도 제주시 남광로2길 43-13, 126.54109201403796, 33.48995858975858, http://place.map.kakao.com/26635265
1997449173, 빽다방 제주법조타워점, 카페, 제주특별자치도 제주시 남광북1길 1, 126.534322660514, 33.4945945766893, http://place.map.kakao.com/1997449173
1386123951, 빽다방 제주연동사거리점, 카페, 제주특별자치도 제주시 선덕로 1, 126.49704725540752, 33.48582696090142, http://place.map.kakao.com/1386123951
844290412, 빽다방 제주도남점, 카페, 제주특별자치도 제주시 도남로5길 23-2, 126.52818967767, 33.4976403991205, http://place.map.kakao.com/844290412
2125531122, 빽다방 앤 긱스타 제주연동점, , 제주특별자치도 제주시 연동13길 3, 126.494727431702, 33.4893517666804, http://place.map.kakao.com/2125531122
27398681, 빽다방 제주삼화부영점, 카페, 제주특별자치도 제주시 화삼북로 135, 126.58772158569758, 33.517224430682944, http://place.map.kakao.com/27398681
1053336547, 빽다방 제주일도동문점, 카페, 제주특별자치도 제주시 신산로 14, 126.531481493095, 33.5120287715944, http://place.map.kakao.com/1053336547
1514090074, 빽다방 제주삼도일동점, 카페, 제주특별자치도 제주시 서사로8길 1, 126.51957570318582, 33.50711728804436, http://place.map.kakao.com/1514090074
1243638314, 빽다방 제주화북남문점, 카페, 제주특별자치도 제주시 일주동로 185, 126.56529194605395, 33.5190077326211, http://place.map.kakao.com/1243638314
546053965, 빽다방 제주일도인제점, 카페, 제주특별자치도 제주시 고마로 100, 126.54097621043, 33.5053781119748, http://place.map.kakao.com/546053965
1792070596, 빽다방 전남함평점, 카페, 전남 함평군 함평읍 중앙길 94, 126.522003755226, 35.0639494870743, http://place.map.kakao.com/1792070596
970276524, 빽다방 전남영광읍점, 카페, 전남 영광군 영광읍 중앙로 166, 126.512057820646, 35.2736984528748, http://place.map.kakao.com/970276524
1561409618, 빽다방 서산해미점, 카페, 충남 서산시 해미면 남문2로 123, 126.54588053033, 36.7127542997186, http://place.map.kakao.com/1561409618
1983783744, 빽다방 영종운서스카이점, 카페, 인천 중구 흰바위로 284, 126.506411528645, 37.477180649764, http://place.map.kakao.com/1983783744
1133204736, 빽다방 운서영종대로점, 카페, 인천 중구 영종대로196번길 19, 126.499520692731, 37.4905990813429, http://place.map.kakao.com/1133204736
207929, 빽다방 영종운서역점, 카페, 인천 중구 신도시남로142번길 6, 126.491163729224, 37.4937132720717, http://place.map.kakao.com/207929
787124243, 빽다방 영종하늘달빛점, 카페, 인천 중구 하늘달빛로 94, 126.557479503209, 37.4872993740391, http://place.map.kakao.com/787124243
387402040, 빽다방 영종하늘도시점, 카페, 인천 중구 하늘별빛로 75, 126.56290713551897, 37.4897721038161, http://place.map.kakao.com/387402040
2048728978, 빽다방 제주봉개DT점, 카페, 제주특별자치도 제주시 명림로 17, 126.60422886625355, 33.484095035754265, http://place.map.kakao.com/2048728978
928150769, 빽다방 제주함덕점, 카페, 제주특별자치도 제주시 조천읍 조함해안로 450, 126.662179407701, 33.5451882964003, http://place.map.kakao.com/928150769
872392826, 빽다방 해남군청점, 카페, 전남 해남군 해남읍 중앙2로 1, 126.598828511382, 34.5717402048603, http://place.map.kakao.com/872392826
84122242, 빽다방 군산대점, 카페, 전북 군산시 황룡로 9, 126.68644703374798, 35.945711298061305, http://place.map.kakao.com/84122242
748551562, 빽다방 보령중앙로점, 카페, 충남 보령시 중앙로 81, 126.59535175466443, 36.35058699605544, http://place.map.kakao.com/748551562
551790550, 빽다방 보령동대점, 카페, 충남 보령시 작은오랏4길 15-22, 126.605859321393, 36.3472787574556, http://place.map.kakao.com/551790550
691157372, 빽다방 홍성내포중앙점, 카페, 충남 홍성군 홍북읍 청사로174번길 2, 126.67894437572578, 36.659405641045275, http://place.map.kakao.com/691157372
27597074, 빽다방 홍성로데오점, 카페, 충남 홍성군 홍성읍 아문길29번길 56, 126.664293216373, 36.6012123637564, http://place.map.kakao.com/27597074
318924418, 빽다방 홍성내포청사점, 카페, 충남 홍성군 홍북읍 청사로48번길 4, 126.67538806426747, 36.6486446108037, http://place.map.kakao.com/318924418
27597031, 빽다방 당진문예의전당점, 카페, 충남 당진시 시청1로 77, 126.63894116323749, 36.890828082285665, http://place.map.kakao.com/27597031
624297944, 빽다방 당진읍내점, 카페, 충남 당진시 당진중앙2로 103-11, 126.63006510173109, 36.894328561450386, http://place.map.kakao.com/624297944
2046468676, 빽다방 빵연구소 송도트리플타워점, 카페, 인천 연수구 송도과학로28번길 8, 126.66073070500599, 37.38282628265973, http://place.map.kakao.com/2046468676
27095607, 빽다방 송도글로벌1호점, 카페, 인천 연수구 송도문화로28번길 28, 126.655232726871, 37.3764681009809, http://place.map.kakao.com/27095607
1747107014, 빽다방 송도아트포레점, 카페, 인천 연수구 인천타워대로 257, 126.632258541517, 37.3934732023204, http://place.map.kakao.com/1747107014
27078972, 빽다방 송도월드마크점, 카페, 인천 연수구 컨벤시아대로 116, 126.64668587667092, 37.393327976091655, http://place.map.kakao.com/27078972
1854316182, 빽다방 송도학원가점, 카페, 인천 연수구 신송로 161, 126.6485783917, 37.3977179672243, http://place.map.kakao.com/1854316182
1149560097, 빽다방 송도캐슬파크점, 카페, 인천 연수구 하모니로138번길 11, 126.64210678143925, 37.38474281733275, http://place.map.kakao.com/1149560097
26808914, 빽다방 인천송도점, 카페, 인천 연수구 컨벤시아대로 81, 126.65015978375439, 37.394980860258215, http://place.map.kakao.com/26808914
131529901, 빽다방 송도캠퍼스타운점, 카페, 인천 연수구 송도과학로27번길 55, 126.6638117733898, 37.38770419120352, http://place.map.kakao.com/131529901
249910431, 빽다방 송도닥터플러스몰점, 카페, 인천 연수구 컨벤시아대로230번길 54, 126.634372422055, 37.3886205677984, http://place.map.kakao.com/249910431
78236771, 빽다방 지식정보단지역점, 카페, 인천 연수구 인천타워대로54번길 9, 126.64582051905455, 37.37899377981806, http://place.map.kakao.com/78236771
1408392663, 빽다방 송도스마트밸리점, 카페, 인천 연수구 송도미래로 30, 126.648390349439, 37.3666439443221, http://place.map.kakao.com/1408392663
27095757, 빽다방 빵연구소 인천동춘점, 카페, 인천 연수구 앵고개로 256, 126.67195168858653, 37.407771094959735, http://place.map.kakao.com/27095757
1491730820, 빽다방 인천연안부두점, 카페, 인천 중구 축항대로86번길 23, 126.605886157972, 37.4542822501613, http://place.map.kakao.com/1491730820
160315738, 빽다방 동인천역점, 카페, 인천 중구 자유공원로 5, 126.63055744588613, 37.47515988474914, http://place.map.kakao.com/160315738
892726602, 빽다방 인천법원삼거리점, 카페, 인천 미추홀구 소성로 159, 126.66639619521693, 37.44228058758595, http://place.map.kakao.com/892726602
26905344, 빽다방 주안역점, 카페, 인천 미추홀구 주안로 100, 126.68073053991955, 37.46381466245507, http://place.map.kakao.com/26905344
27095956, 빽다방 인하대점, 카페, 인천 미추홀구 인하로77번길 29, 126.65749575848886, 37.45252844626674, http://place.map.kakao.com/27095956
1642155811, 빽다방 인천월미도점, 카페, 인천 중구 월미로 237, 126.59954727570702, 37.47476242635197, http://place.map.kakao.com/1642155811
794712170, 빽다방 인천숭의용마루점, 카페, 인천 미추홀구 인주대로 74, 126.64543749057898, 37.45788542085518, http://place.map.kakao.com/794712170
27095951, 빽다방 인천신포시장점, 카페, 인천 중구 개항로 28, 126.62570178234773, 37.47177934870613, http://place.map.kakao.com/27095951
1834767729, 빽다방 주안북부역점, 카페, 인천 미추홀구 길파로 9, 126.679199418694, 37.4666081448405, http://place.map.kakao.com/1834767729
26532886, 빽다방 인천연수점, 카페, 인천 연수구 먼우금로188번길 12, 126.67662095871073, 37.41357478780763, http://place.map.kakao.com/26532886
1149148815, 빽다방 송도더테라스점, 카페, 인천 연수구 센트럴로 415, 126.62601934483536, 37.411175717581216, http://place.map.kakao.com/1149148815
831488218, 빽다방 송림오거리점, 카페, 인천 동구 송림로 91, 126.64496629791736, 37.47626454120973, http://place.map.kakao.com/831488218
27386593, 빽다방 인천차이나타운점, 카페, 인천 중구 차이나타운로 24-2, 126.61899379281365, 37.47708735304922, http://place.map.kakao.com/27386593
1587410749, 빽다방 인천가좌점, 카페, 인천 서구 원적로 96, 126.682584525622, 37.4947683005644, http://place.map.kakao.com/1587410749
117332009, 빽다방 인천옥련점, 카페, 인천 연수구 독배로 35, 126.64449840419074, 37.42393432264705, http://place.map.kakao.com/117332009
2007346636, 빽다방 인천도화청운대점, 카페, 인천 미추홀구 숙골로87번길 24, 126.66071402353639, 37.46989474547404, http://place.map.kakao.com/2007346636
759845742, 빽다방 인천학익점, 카페, 인천 미추홀구 매소홀로 355, 126.661977022324, 37.4414508150159, http://place.map.kakao.com/759845742
1277875265, 빽다방 인하대역SK점, 카페, 인천 미추홀구 용정공원로 33, 126.64824490542246, 37.44850349661621, http://place.map.kakao.com/1277875265
27597067, 빽다방 인천가좌한신점, 카페, 인천 서구 장고개로337번길 16, 126.6851188278214, 37.493116335207, http://place.map.kakao.com/27597067
684731965, 빽다방 송도랜드마크시티점, 카페, 인천 연수구 랜드마크로 68, 126.619698943769, 37.414859625236, http://place.map.kakao.com/684731965
27398553, 빽다방 인천신기시장점, 카페, 인천 미추홀구 인하로 259, 126.67704881423087, 37.448350550300255, http://place.map.kakao.com/27398553
1426281398, 빽다방 주안센트레빌점, 카페, 인천 미추홀구 석정로 440, 126.684485447114, 37.4662601719385, http://place.map.kakao.com/1426281398
1464633522, 빽다방 인천용현토지점, 카페, 인천 미추홀구 낙섬중로 40, 126.63772503417565, 37.45170814314348, http://place.map.kakao.com/1464633522
359577156, 빽다방 인천더블유병원점, 카페, 인천 미추홀구 인주대로 400, 126.68112162748248, 37.45104031231226, http://place.map.kakao.com/359577156
2123521036, 빽다방 인천석바위시장점, 카페, 인천 미추홀구 경원대로 848, 126.68975342097842, 37.45850652675002, http://place.map.kakao.com/2123521036
1232949236, 빽다방 인천관교한신점, 카페, 인천 미추홀구 인하로352번길 3, 126.68744523422605, 37.44795772952274, http://place.map.kakao.com/1232949236
1581187369, 빽다방 인천아인여성병원점, 카페, 인천 미추홀구 경인로 372, 126.681163209044, 37.458017841352, http://place.map.kakao.com/1581187369
709003096, 빽다방 인천청라쓰리엠점, 카페, 인천 서구 중봉대로586번길 9-4, 126.65086628141393, 37.531937862444046, http://place.map.kakao.com/709003096
27095952, 빽다방 인천청라진영점, 카페, 인천 서구 청라라임로 71, 126.65273002195991, 37.533810222937575, http://place.map.kakao.com/27095952
347044868, 빽다방 인천신현하늘채점, 카페, 인천 서구 석곶로 2, 126.67381516563734, 37.51762173892975, http://place.map.kakao.com/347044868
2089085754, 빽다방 인천서구청점, 카페, 인천 서구 탁옥로 45, 126.67457925744684, 37.54405371093895, http://place.map.kakao.com/2089085754
1581128187, 빽다방 청라SK뷰점, 카페, 인천 서구 옥빛로 4, 126.63096479954372, 37.52563794670556, http://place.map.kakao.com/1581128187
1220088622, 빽다방 인천루원시티점, 카페, 인천 서구 봉오재3로 96, 126.670355865745, 37.5271852472796, http://place.map.kakao.com/1220088622
1417957773, 빽다방 청라로제비앙점, 카페, 인천 서구 차오름로 29, 126.62254557996, 37.5391587163071, http://place.map.kakao.com/1417957773
101040378, 빽다방 인천마전역점, 카페, 인천 서구 완정로 60, 126.6682975789539, 37.596980290830516, http://place.map.kakao.com/101040378
970013270, 빽다방 가정역SK리더스뷰점, 카페, 인천 서구 가정로 437, 126.6709490178597, 37.52272695912585, http://place.map.kakao.com/970013270
1768617330, 빽다방 청라좋은병원점, 카페, 인천 서구 청라에메랄드로 84, 126.65667547629398, 37.532519818635905, http://place.map.kakao.com/1768617330
832099891, 빽다방 청라호수공원점, 카페, 인천 서구 청라루비로 99, 126.64019894553125, 37.53397903723492, http://place.map.kakao.com/832099891
1887276946, 빽다방 인천청라커낼점, 카페, 인천 서구 청라커낼로260번길 15, 126.646659433327, 37.532023559284, http://place.map.kakao.com/1887276946
368655177, 빽다방 인천검암서해점, 카페, 인천 서구 승학로 497, 126.675007743026, 37.5655093597508, http://place.map.kakao.com/368655177
2104694568, 빽다방 인천원창북항점, 카페, 인천 서구 북항로32번안길 35, 126.646679702004, 37.5090139197101, http://place.map.kakao.com/2104694568
673526705, 빽다방 인천당하점, 카페, 인천 서구 청마로167번길 3, 126.676292601345, 37.5921416593592, http://place.map.kakao.com/673526705
154235373, 빽다방 인천국제성모병원점, 카페, 인천 서구 탁옥로 104, 126.681032828083, 37.5434514345482, http://place.map.kakao.com/154235373
891759504, 빽다방 인천검단블루텍점, 카페, 인천 서구 보듬로 146, 126.613475408273, 37.5952791063085, http://place.map.kakao.com/891759504
1806033330, 빽다방 인천검암우체국점, 카페, 인천 서구 승학로 414, 126.67333666916562, 37.55860584570721, http://place.map.kakao.com/1806033330
961008616, 빽다방 김포구래점, 카페, 경기 김포시 김포한강9로 80, 126.62615982849445, 37.64390366474836, http://place.map.kakao.com/961008616
27392955, 빽다방 김포장기쌍용점, 카페, 경기 김포시 김포한강2로23번길 50, 126.67972223485997, 37.64100690892788, http://place.map.kakao.com/27392955
1401866239, 빽다방 김포장기역점, 카페, 경기 김포시 김포한강1로51번길 28, 126.66718684621713, 37.64421754463872, http://place.map.kakao.com/1401866239
1128661493, 빽다방 김포통진마송점, 카페, 경기 김포시 통진읍 조강로 39, 126.60076858872044, 37.68967019030558, http://place.map.kakao.com/1128661493
576957463, 빽다방 김포마산점, 카페, 경기 김포시 김포한강8로162번길 10, 126.643970535937, 37.6363049316976, http://place.map.kakao.com/576957463
27392960, 빽다방 김포한강CGV점, 카페, 경기 김포시 김포한강11로 288-32, 126.6841175684465, 37.65430731335335, http://place.map.kakao.com/27392960
872149607, 빽다방 인천검단사거리점, 카페, 인천 서구 검단로 474, 126.65698238112374, 37.60156910925721, http://place.map.kakao.com/872149607
1900931097, 빽다방 나주영산포점, 카페, 전남 나주시 이창1길 10-1, 126.713029700944, 34.9957048152138, http://place.map.kakao.com/1900931097
1791960728, 빽다방 나주혁신빛가람점, 카페, 전남 나주시 월정5길 1, 126.787287191643, 35.0092197054425, http://place.map.kakao.com/1791960728
1606581116, 빽다방 나주혁신점, 카페, 전남 나주시 상야1길 7, 126.785871815301, 35.0226405518949, http://place.map.kakao.com/1606581116
1146463296, 빽다방 전남나주중앙점, 카페, 전남 나주시 나주로 173, 126.719708803133, 35.0330915352162, http://place.map.kakao.com/1146463296
193920816, 빽다방 광주호남대점, 카페, 광주 광산구 선운로 8, 126.770366013585, 35.148275559508, http://place.map.kakao.com/193920816
690401399, 빽다방 전남장성점, 카페, 전남 장성군 장성읍 영천로 167-2, 126.782274744825, 35.3005802590555, http://place.map.kakao.com/690401399
1165286531, 빽다방 고창군청점, 카페, 전북 고창군 고창읍 중거리당산로 177, 126.701860241085, 35.4348611545317, http://place.map.kakao.com/1165286531
1950670872, 빽다방 전북부안점, 카페, 전북 부안군 부안읍 번영로 123, 126.734063341348, 35.7264219328008, http://place.map.kakao.com/1950670872
729933209, 빽다방 군산수송점, 카페, 전북 군산시 동수송안길 21, 126.71677640947321, 35.96591582208756, http://place.map.kakao.com/729933209
668890811, 빽다방 군산나운점, 카페, 전북 군산시 하나운로 79, 126.70257764055665, 35.9655290885427, http://place.map.kakao.com/668890811
942169995, 빽다방 군산조촌디오션점, 카페, 전북 군산시 궁포3로 12, 126.741737486766, 35.976608515218, http://place.map.kakao.com/942169995
331005640, 빽다방 군산시청점, 카페, 전북 군산시 조촌4길 15, 126.735747952837, 35.9679580382401, http://place.map.kakao.com/331005640
1135379531, 빽다방 당진기지시점, 카페, 충남 당진시 송악읍 반촌로 70-17, 126.69295990076463, 36.90206790870249, http://place.map.kakao.com/1135379531
2032542547, 빽다방 시흥배곧메가점, 카페, 경기 시흥시 서울대학로278번길 43-13, 126.73019042469235, 37.369227618668965, http://place.map.kakao.com/2032542547
27075598, 빽다방 시흥정왕로데오점, 카페, 경기 시흥시 중심상가2길 22, 126.73770240543942, 37.34487177781187, http://place.map.kakao.com/27075598
27398660, 빽다방 정왕역점, 카페, 경기 시흥시 마유로418번길 10, 126.741861100317, 37.3514818481807, http://place.map.kakao.com/27398660
27095590, 빽다방 소래포구한화점, 카페, 인천 남동구 소래역남로 12, 126.73517936397438, 37.39774360641396, http://place.map.kakao.com/27095590
27597069, 빽다방 인천라피에스타점, 카페, 인천 남동구 논고개로 61, 126.72724381011992, 37.39762735655755, http://place.map.kakao.com/27597069
27153808, 빽다방 시흥정왕옥구점, 카페, 경기 시흥시 옥구상가2길 3, 126.72430917204963, 37.35367408629041, http://place.map.kakao.com/27153808
27597051, 빽다방 시흥거모점, 카페, 경기 시흥시 군자로 517, 126.78537064818181, 37.34407944863491, http://place.map.kakao.com/27597051
445892978, 빽다방 시흥월곶점, 카페, 경기 시흥시 월곶중앙로 59, 126.73855851927866, 37.388603070391675, http://place.map.kakao.com/445892978
1318671572, 빽다방 시흥배곧타운점, 카페, 경기 시흥시 배곧4로 30, 126.72750294810363, 37.37720451944945, http://place.map.kakao.com/1318671572
32549467, 빽다방 시흥장곡공원점, 카페, 경기 시흥시 진말로9번길 15, 126.783974191312, 37.3780996353888, http://place.map.kakao.com/32549467
