1318380501, 할리스 방이역점, 카페, 서울 송파구 양재대로72길 5, 127.12744651482883, 37.51009347398022, http://place.map.kakao.com/1318380501
21126375, 할리스 고덕리앤파크점, 카페, 서울 강동구 상일로 151, 127.170504796983, 37.5604771315316, http://place.map.kakao.com/21126375
755230638, 할리스 다산한강점, 카페, 경기 남양주시 다산지금로163번길 9-12, 127.175184474078, 37.5984993880597, http://place.map.kakao.com/755230638
11197891, 할리스 테크노마트점, 카페, 서울 광진구 광나루로56길 85, 127.09550998848691, 37.535626484476936, http://place.map.kakao.com/11197891
1614488124, 할리스 망우점, 카페, 서울 중랑구 망우로 470, 127.104326679525, 37.6001438071353, http://place.map.kakao.com/1614488124
1365922805, 할리스 별내카페거리점, 카페, 경기 남양주시 두물로39번길 33, 127.127736587411, 37.6588218154377, http://place.map.kakao.com/1365922805
213351416, 할리스 다산진건점, 카페, 경기 남양주시 다산중앙로20번길 10-44, 127.15707719742, 37.6144399445634, http://place.map.kakao.com/213351416
1996176113, 할리스 다산지금점, 카페, 경기 남양주시 다산중앙로82번안길 143-15, 127.16675525640194, 37.61281569946613, http://place.map.kakao.com/1996176113
104611617, 할리스 다산센트럴점, 카페, 경기 남양주시 다산중앙로 105-14, 127.152411482067, 37.6225531453056, http://place.map.kakao.com/104611617
61536790, 할리스 다산리코빌파크뷰점, 카페, 경기 남양주시 다산순환로 220, 127.14802153585455, 37.62913413034694, http://place.map.kakao.com/61536790
172074403, 할리스 모다아울렛구리점, 카페, 경기 구리시 경춘북로 230, 127.11594903299435, 37.63324606494488, http://place.map.kakao.com/172074403
1786525655, 할리스 남양주진접점, 카페, 경기 남양주시 진접읍 해밀예당1로 8-12, 127.18525092223689, 37.709621868181856, http://place.map.kakao.com/1786525655
170587540, 할리스 의정부민락점, 카페, 경기 의정부시 오목로205번길 55, 127.09620706603707, 37.745704817955094, http://place.map.kakao.com/170587540
100453944, 할리스 양주삼숭DI점, 카페, , 127.10229201578139, 37.809931164795714, http://place.map.kakao.com/100453944
1240677051, 할리스 동학사점, 카페, 충남 공주시 반포면 동학사2로 133, 127.2385381785278, 36.35753513574163, http://place.map.kakao.com/1240677051
659190871, 할리스 세종가람DT점, 카페, 세종특별자치시 금송로 589, 127.244332869599, 36.4647085034112, http://place.map.kakao.com/659190871
298655571, 할리스 세종어반아트리움점, 카페, 세종특별자치시 나성로 96, 127.26097432612205, 36.48836024179701, http://place.map.kakao.com/298655571
27447346, 할리스 세종어진점, 카페, 세종특별자치시 절재로 194, 127.262759507198, 36.5083827080136, http://place.map.kakao.com/27447346
1365629491, 할리스 안성맞춤휴게소평택방향점, 카페, 경기 안성시 서운면 평택제천고속도로 41, 127.27473062926826, 36.96988368930342, http://place.map.kakao.com/1365629491
85167537, 할리스 안성맞춤휴게소음성방향점, 카페, 경기 안성시 서운면 평택제천고속도로 40, 127.27425049714945, 36.968148409972436, http://place.map.kakao.com/85167537
636011500, 할리스 하남미사역점, 카페, 경기 하남시 미사강변동로 85, 127.192145864013, 37.562588264518, http://place.map.kakao.com/636011500
882792037, 할리스 미사효성해링턴점, 카페, 경기 하남시 아리수로 570, 127.19042168705498, 37.56643920747681, http://place.map.kakao.com/882792037
892437003, 할리스 미사가로수길점, 카페, 경기 하남시 미사강변한강로 295, 127.19833964841564, 37.5644304676166, http://place.map.kakao.com/892437003
1968567706, 할리스 하남덕풍점, 카페, 경기 하남시 덕풍북로 2, 127.19839177130572, 37.546522178800714, http://place.map.kakao.com/1968567706
26342218, 할리스 대전관저점, 카페, 대전 서구 관저중로64번길 26, 127.336338531172, 36.2976706100881, http://place.map.kakao.com/26342218
555362339, 할리스 대전도안DT점, 카페, 대전 유성구 도안동로 488, 127.348382368508, 36.3472803348388, http://place.map.kakao.com/555362339
26469904, 할리스 대전유성온천점, 카페, 대전 유성구 온천로 45, 127.342719844694, 36.3556452024461, http://place.map.kakao.com/26469904
27402352, 할리스 대전타임월드점, 카페, 대전 서구 둔산로 32-13, 127.377226345445, 36.3510786321694, http://place.map.kakao.com/27402352
1886883112, 할리스 대전탄방점, 카페, 대전 서구 계룡로571번길 23-19, 127.386248033987, 36.3434402879454, http://place.map.kakao.com/1886883112
1526108158, 할리스 대전가장점, 카페, 대전 서구 도솔로 314, 127.3826212305656, 36.33618847249416, http://place.map.kakao.com/1526108158
27495407, 할리스 대전신성점, 카페, 대전 유성구 유성대로1184번길 18, 127.35254613581445, 36.393390147492276, http://place.map.kakao.com/27495407
17100705, 할리스 충남대점, 카페, 대전 유성구 대학로 84, 127.34469692299642, 36.36084470136784, http://place.map.kakao.com/17100705
2052519563, 할리스 대전만년점, 카페, 대전 서구 둔산대로117번길 95, 127.3820849139126, 36.36912992104638, http://place.map.kakao.com/2052519563
27165943, 할리스 대전도안마을점, 카페, 대전 유성구 도안대로 560, 127.344273284326, 36.3511745105926, http://place.map.kakao.com/27165943
27588315, 할리스 대전반석역점, 카페, 대전 유성구 반석동로40번길 40, 127.314261672359, 36.391283738095, http://place.map.kakao.com/27588315
12508555, 할리스 대전롯데점, 카페, 대전 서구 용문로 41-80, 127.389121420802, 36.3397433542278, http://place.map.kakao.com/12508555
193428246, 할리스 대전건양대병원점, 카페, 대전 서구 관저동로 158, 127.342578794199, 36.3058834013326, http://place.map.kakao.com/193428246
1634712071, 피플존 탄방동 할리스커피 건물 4층, , , 127.386243596114, 36.3434439069921, http://place.map.kakao.com/1634712071
1798795298, 할리스 세종소담DI점, 카페, 세종특별자치시 소담로 40, 127.30691458257081, 36.483746037985405, http://place.map.kakao.com/1798795298
13057663, 할리스 충북오송점, 카페, 충북 청주시 흥덕구 오송읍 만수1길 3, 127.32721423278227, 36.62298852972936, http://place.map.kakao.com/13057663
27588307, 할리스 옥산휴게소부산방향점, 카페, 충북 청주시 흥덕구 옥산면 경부고속도로 309, 127.369778279128, 36.6577098963787, http://place.map.kakao.com/27588307
13057633, 할리스 대전오류점, 카페, 대전 중구 계룡로 876, 127.411119877537, 36.32328090188146, http://place.map.kakao.com/13057633
25413712, 할리스 대전둔산청솔점, 카페, 대전 서구 둔산로 223, 127.39888531638861, 36.3514579817241, http://place.map.kakao.com/25413712
26469905, 할리스 대전한남대점, 카페, 대전 대덕구 한남로 65, 127.4210029858666, 36.35133344057107, http://place.map.kakao.com/26469905
599299253, 할리스 대전호텔ICC점, 카페, 대전 유성구 엑스포로123번길 55, 127.392779528798, 36.3770183367237, http://place.map.kakao.com/599299253
439622230, 할리스 대전문지점, 카페, 대전 유성구 문지로299번길 94-19, 127.40635911331229, 36.394024833384954, http://place.map.kakao.com/439622230
8147623, 할리스 대전전민점, 카페, 대전 유성구 전민로22번길 62, 127.402736224816, 36.3991611414102, http://place.map.kakao.com/8147623
12508426, 할리스 가오CGV점, 카페, 대전 동구 은어송로 72, 127.45802625059, 36.3070243467936, http://place.map.kakao.com/12508426
14701818, 할리스 충북대점, 카페, 충북 청주시 흥덕구 내수동로 53, 127.453484094671, 36.6327513334349, http://place.map.kakao.com/14701818
1876030532, 할리스커피 청주산남DT점, 카페, , 127.469842853896, 36.6160026086833, http://place.map.kakao.com/1876030532
21907652, 할리스 청주성화점, 카페, 충북 청주시 서원구 신성화로 39, 127.458144521012, 36.6184379628382, http://place.map.kakao.com/21907652
19037693, 할리스 청주분평점, 카페, 충북 청주시 서원구 월평로 4, 127.485548390942, 36.610990632307, http://place.map.kakao.com/19037693
18375271, 할리스 청주강서점, 카페, 충북 청주시 흥덕구 서현동로 8, 127.430482678459, 36.6230683983295, http://place.map.kakao.com/18375271
26089428, 할리스 청주율량현대점, 카페, 충북 청주시 청원구 율봉로 150, 127.48575165653864, 36.66813481953083, http://place.map.kakao.com/26089428
1175057646, 할리스 청주NC백화점CGV점, 카페, 충북 청주시 흥덕구 2순환로 1233, 127.431130731084, 36.6262164126461, http://place.map.kakao.com/1175057646
27588337, 할리스 청주성모병원점, 카페, 충북 청주시 청원구 주성로 173-19, 127.485619421564, 36.6736150879507, http://place.map.kakao.com/27588337
1088235563, 할리스 오창휴게소통영방향점, 카페, 충북 청주시 청원구 오창읍 중부고속도로 21, 127.481786328989, 36.7584941921802, http://place.map.kakao.com/1088235563
22676678, 할리스 충북진천점, 카페, 충북 진천군 진천읍 중앙북로 28, 127.44007486153302, 36.85884321123126, http://place.map.kakao.com/22676678
8143189, 할리스 이천점, 카페, 경기 이천시 어재연로 35, 127.44522662617871, 37.27977514932183, http://place.map.kakao.com/8143189
152581216, 할리스 이천갈산점, 카페, 경기 이천시 향교로 161, 127.454942751841, 37.2849768051609, http://place.map.kakao.com/152581216
1593742156, 할리스 이천하이닉스점, 카페, 경기 이천시 부발읍 경충대로 2091, 127.48648478866738, 37.250667988473005, http://place.map.kakao.com/1593742156
1808630256, 할리스 마장휴게소하남방향점, 카페, 경기 이천시 마장면 중부고속도로 82, 127.407397551209, 37.2630836581724, http://place.map.kakao.com/1808630256
1072893755, 할리스 마장프리미엄휴게소 하남방향점, 카페, 경기 이천시 마장면 중부고속도로 82, 127.407327025292, 37.2631758065224, http://place.map.kakao.com/1072893755
1930215295, 할리스 순천신대점, 카페, 전남 순천시 해룡면 향매로 67, 127.546979918618, 34.9341970341754, http://place.map.kakao.com/1930215295
27603684, 할리스 지리산휴게소담양방향점, 카페, 전북 남원시 아영면 광주대구고속도로 75, 127.56734110079495, 35.48399245903794, http://place.map.kakao.com/27603684
27603686, 할리스 지리산휴게소대구방향점, 카페, 전북 남원시 아영면 광주대구고속도로 76, 127.56664182363059, 35.481231466866525, http://place.map.kakao.com/27603686
287932835, 할리스 충북옥천점, 카페, 충북 옥천군 옥천읍 송신길 172, 127.579532482854, 36.291618688513, http://place.map.kakao.com/287932835
25971700, 할리스 청주율량점, 카페, 충북 청주시 청원구 1순환로 122, 127.499037016962, 36.6642960755326, http://place.map.kakao.com/25971700
1479582677, 할리스 청주명암레이크점, 카페, 충북 청주시 상당구 명암로 32, 127.51073680067428, 36.63853828382895, http://place.map.kakao.com/1479582677
139200266, 할리스 청주동남점, 카페, 충북 청주시 상당구 중고개로141번길 13-16, 127.51646462843709, 36.61550327631977, http://place.map.kakao.com/139200266
1225837126, 할리스 양평점, 카페, 경기 양평군 양평읍 중앙로 90, 127.498603668801, 37.4942110056913, http://place.map.kakao.com/1225837126
27419854, 할리스 여수웅천점, 카페, 전남 여수시 예울마루로 35-24, 127.672005134021, 34.7465133998158, http://place.map.kakao.com/27419854
27588138, 할리스 옥천휴게소서울방향점, 카페, 충북 옥천군 옥천읍 옥천동이로 242-34, 127.59907487317486, 36.297926119024844, http://place.map.kakao.com/27588138
696053331, 할리스 옥천휴게소부산방향점, 카페, 충북 옥천군 옥천읍 서대구일로 265-19, 127.595192624197, 36.2968677039743, http://place.map.kakao.com/696053331
22733366, 할리스 광양중동점, 카페, 전남 광양시 공영로 92-1, 127.69924861959886, 34.93566319570487, http://place.map.kakao.com/22733366
27588241, 할리스 황간휴게소서울방향점, 카페, 충북 영동군 황간면 회포1길 65, 127.854831192434, 36.2495899295309, http://place.map.kakao.com/27588241
27588251, 할리스 황간휴게소부산방향점, 카페, 충북 영동군 황간면 회포길 102, 127.85267916765387, 36.24884470501, http://place.map.kakao.com/27588251
8642546, 할리스 홍천점, 카페, 강원 홍천군 홍천읍 꽃뫼로 98, 127.884499612235, 37.6911984596418, http://place.map.kakao.com/8642546
759523750, 할리스 괴산휴게소창원방향점, 카페, 충북 괴산군 장연면 중부내륙고속도로 205, 127.957916803047, 36.8313978297081, http://place.map.kakao.com/759523750
26197359, 할리스 원주중앙점, 카페, 강원 원주시 중평길 4, 127.9499749449837, 37.34922122612375, http://place.map.kakao.com/26197359
19041415, 할리스 원주단계택지점, 카페, 강원 원주시 장미공원길 27-9, 127.931972553062, 37.3460055143507, http://place.map.kakao.com/19041415
2115945494, 할리스 원주세브란스기독병원점, 카페, 강원 원주시 일산로 20, 127.945725290842, 37.3483705002256, http://place.map.kakao.com/2115945494
1734340839, 할리스 연세대학교원주장례식장점, 카페, 강원 원주시 일산로 20, 127.944299904928, 37.3487314743167, http://place.map.kakao.com/1734340839
683760247, 할리스 원주휴게소춘천방향점, 카페, 강원 원주시 호저면 마근거리길 110, 127.931783268572, 37.434704192099, http://place.map.kakao.com/683760247
1189726169, 할리스 (상)사천휴게소점, 카페, 경남 사천시 곤양면 묵실길 31-11, 128.0124342824767, 35.074918623579954, http://place.map.kakao.com/1189726169
1799699149, 할리스 사천휴게소순천방향점, 카페, 경남 사천시 곤양면 묵실길 31-11, 128.012513792204, 35.074964828613, http://place.map.kakao.com/1799699149
1460557615, 할리스 사천휴게소부산방향점, 카페, 경남 사천시 곤양면 서삼로 619, 128.01079686460355, 35.073186417302885, http://place.map.kakao.com/1460557615
11825685, 할리스 진주교대점, 카페, 경남 진주시 진양호로 348, 128.068228580883, 35.1834508315143, http://place.map.kakao.com/11825685
1843153010, 할리스 진주평거점, 카페, 경남 진주시 진양호로 46, 128.04487185784265, 35.16702729808656, http://place.map.kakao.com/1843153010
27588288, 할리스 거창휴게소광주방향점, 카페, 경남 거창군 가조면 가조가야로 1543-81, 128.0580018537636, 35.70868495689032, http://place.map.kakao.com/27588288
1175326871, 할리스 거창휴게소대구방향점, 카페, 경남 거창군 가조면 가조가야로 1523, 128.056972498814, 35.7062949318144, http://place.map.kakao.com/1175326871
936375840, 할리스 추풍령휴게소서울방향점, 카페, 경북 김천시 봉산면 경부고속도로 214-1, 128.003292466224, 36.1994715339403, http://place.map.kakao.com/936375840
1175150762, 할리스 추풍령휴게소부산방향점, 카페, 경북 김천시 봉산면 경부고속도로 213, 128.00042200545, 36.2003714917426, http://place.map.kakao.com/1175150762
88297174, 할리스 치악휴게소부산방향점, 카페, 강원 원주시 신림면 치악로 416, 128.048742640665, 37.2535983936098, http://place.map.kakao.com/88297174
1806550647, 할리스 치악휴게소춘천방향점, 카페, 강원 원주시 신림면 다리실2길 32, 128.048880428901, 37.2567074346592, http://place.map.kakao.com/1806550647
1175147838, 할리스 홍천휴게소양양방향점, 카페, 강원 홍천군 화촌면 서울양양고속도로 84, 128.003224119759, 37.7572922466494, http://place.map.kakao.com/1175147838
1287555785, 할리스 (상)홍천휴게소R점, 카페, 강원 홍천군 화촌면 서울양양고속도로 83, 128.00638702689815, 37.75899236383577, http://place.map.kakao.com/1287555785
1500651951, 할리스 진주혁신도시점, 카페, 경남 진주시 에나로128번길 24, 128.14404499658426, 35.175770599010065, http://place.map.kakao.com/1500651951
569922, 할리스 김천혁신도시점, 카페, 경북 김천시 혁신로 246, 128.1815067879994, 36.122005799140624, http://place.map.kakao.com/569922
19336815, 할리스 문경휴게소창원방향점, 카페, 경북 문경시 중부내륙고속도로 173, 128.14996231206177, 36.62045020417933, http://place.map.kakao.com/19336815
12789808, 할리스 인제점, 카페, 강원 인제군 인제읍 인제로 198, 128.172386775675, 38.0689975850326, http://place.map.kakao.com/12789808
1392192343, 할리스 성주성밖숲점, 카페, 경북 성주군 성주읍 성밖숲길 7, 128.27949061383325, 35.9173962983868, http://place.map.kakao.com/1392192343
1681135433, 할리스 선산휴게소마산방향점, 카페, 경북 구미시 옥성면 중부내륙고속도로 129, 128.24998170281108, 36.27469987380968, http://place.map.kakao.com/1681135433
27588301, 할리스 단양휴게소부산방향점, 카페, , 128.28866824753703, 36.995212281234984, http://place.map.kakao.com/27588301
1175296296, 할리스 남성주휴게소양평방향점, 카페, 경북 성주군 용암면 중부내륙고속도로 76, 128.320022988704, 35.8572528005724, http://place.map.kakao.com/1175296296
1175228205, 할리스 남성주휴게소창원방향점, 카페, 경북 성주군 선남면 중부내륙고속도로 77, 128.316552354937, 35.8688223740043, http://place.map.kakao.com/1175228205
134018329, 할리스 구미금오산점, 카페, 경북 구미시 금오산로 209, 128.32361080919208, 36.12200575406093, http://place.map.kakao.com/134018329
23754040, 할리스 구미CGV점, 카페, 경북 구미시 구미중앙로 44, 128.327826712462, 36.1301603690247, http://place.map.kakao.com/23754040
670847940, 할리스 대구현풍테크노점, 카페, 대구 달성군 유가읍 테크노공원로 65, 128.460111835364, 35.6919866435207, http://place.map.kakao.com/670847940
26380176, 할리스 현풍휴게소대구방향점, 카페, 대구 달성군 현풍읍 비슬로 741, 128.4381514405017, 35.701887455652596, http://place.map.kakao.com/26380176
420802355, 할리스 대구세천점, 카페, 대구 달성군 다사읍 세천로 141, 128.4764316467013, 35.87437109483341, http://place.map.kakao.com/420802355
2048528971, 할리스 칠곡왜관점, 카페, 경북 칠곡군 석적읍 석적로 178-3, 128.40229531342058, 36.01506151906421, http://place.map.kakao.com/2048528971
996199551, 할리스 마산저도점, 카페, 경남 창원시 마산합포구 구산면 해양관광로 1872-50, 128.562508867294, 35.0677852027805, http://place.map.kakao.com/996199551
24982815, 할리스 마산터미널점, 카페, 경남 창원시 마산회원구 합성남로 3, 128.58324210571794, 35.238520063811194, http://place.map.kakao.com/24982815
80890644, 할리스 마산호계점, 카페, 경남 창원시 마산회원구 내서읍 광려천동로 28, 128.520672840205, 35.2536306207529, http://place.map.kakao.com/80890644
196490741, 할리스 대구팔달교DT점, 카페, 대구 서구 팔달로 34, 128.5537485384924, 35.891368218120014, http://place.map.kakao.com/196490741
26617324, 할리스 대구장기점, 카페, 대구 달서구 장기로 268, 128.530898290427, 35.8437636862831, http://place.map.kakao.com/26617324
716159313, 할리스 대구본리점, 카페, 대구 달서구 장기로 203, 128.538123519331, 35.8433109414354, http://place.map.kakao.com/716159313
26469902, 할리스 대구상인점, 카페, 대구 달서구 상화북로 194, 128.546826672636, 35.8131799180451, http://place.map.kakao.com/26469902
179406834, 할리스 대구성서점, 카페, 대구 달서구 성서로 419, 128.506694968291, 35.8549952889014, http://place.map.kakao.com/179406834
2102420492, 할리스 대구침산점, 카페, 대구 북구 성북로 36, 128.58749915405437, 35.89081861804392, http://place.map.kakao.com/2102420492
1634397770, 할리스 대구이월드점, 카페, 대구 달서구 두류공원로 200, 128.5650420039734, 35.85347341837486, http://place.map.kakao.com/1634397770
1932895368, 할리스 대구월성CGV점, 카페, 대구 달서구 조암로 29, 128.52681129077004, 35.8245525581532, http://place.map.kakao.com/1932895368
24492728, 할리스 대구관음점, 카페, 대구 북구 구암로 59, 128.547665280877, 35.9332742558531, http://place.map.kakao.com/24492728
27363706, 할리스 대구동천점, 카페, 대구 북구 동천로 125, 128.560501451836, 35.9427790619749, http://place.map.kakao.com/27363706
21074943, 할리스 군위휴게소춘천방향점, 카페, 경북 군위군 군위읍 경북대로 4082, 128.57689977198464, 36.265012644868165, http://place.map.kakao.com/21074943
19386667, 할리스 군위휴게소부산방향점, 카페, 경북 군위군 군위읍 경북대로 4084, 128.57489664966673, 36.26655107363299, http://place.map.kakao.com/19386667
993798269, 할리스 속초엑스포점, 카페, 강원 속초시 청초호반로 75, 128.58640542221, 38.1899221927312, http://place.map.kakao.com/993798269
841570435, 할리스 진해속천점, 카페, 경남 창원시 진해구 태평로 132, 128.67073891542293, 35.14167042171721, http://place.map.kakao.com/841570435
27390683, 할리스 창원귀산점, 카페, 경남 창원시 성산구 삼귀로 189, 128.599585344075, 35.16965991171, http://place.map.kakao.com/27390683
1622913491, 할리스 진해경화점, 카페, 경남 창원시 진해구 조천북로 76, 128.68075933385043, 35.160394542431774, http://place.map.kakao.com/1622913491
27088057, 할리스 창원상남점, 카페, 경남 창원시 성산구 마디미로31번길 3, 128.68443559419936, 35.22149056061499, http://place.map.kakao.com/27088057
1912193099, 할리스 창원팔용점, 카페, 경남 창원시 의창구 창원대로18번길 6-8, 128.60560233344924, 35.25431415184606, http://place.map.kakao.com/1912193099
1692399539, 할리스 상남중앙점, 카페, 경남 창원시 성산구 마디미로38번길 11, 128.682320990783, 35.2215199727432, http://place.map.kakao.com/1692399539
27588179, 할리스커피 대구힐크레스트점, 카페, 대구 달성군 가창면 가창로 1003, 128.625551411307, 35.7930329664731, http://place.map.kakao.com/27588179
12508589, 할리스 대구동성로점, 카페, 대구 중구 동성로6길 32, 128.59706960245967, 35.86864979134761, http://place.map.kakao.com/12508589
1473400631, 할리스 대구침산네거리점, 카페, 대구 북구 침산남로 157, 128.59301936245566, 35.88809255228409, http://place.map.kakao.com/1473400631
26119385, 할리스 대구수성못점, 카페, 대구 수성구 용학로 115, 128.62268512381164, 35.825087661205934, http://place.map.kakao.com/26119385
1969948663, 할리스 범어천로점, 카페, 대구 수성구 범어천로 200, 128.62074521209288, 35.86331238967119, http://place.map.kakao.com/1969948663
852394387, 할리스 수성네거리점, 카페, 대구 수성구 들안로 326, 128.617844384386, 35.859100814886, http://place.map.kakao.com/852394387
1409426251, 할리스 경북대북문점, 카페, 대구 북구 대학로17길 3, 128.608759752586, 35.8926839682366, http://place.map.kakao.com/1409426251
777964061, 할리스 동대구환승센터점, 카페, 대구 동구 동부로 149, 128.629343688853, 35.8781288172037, http://place.map.kakao.com/777964061
13057666, 할리스 동대구역사점, 카페, 대구 동구 동대구로 550, 128.62834846376987, 35.87932821213053, http://place.map.kakao.com/13057666
26469900, 할리스 대구봉무공원점, 카페, 대구 동구 단산길 4, 128.645653673437, 35.9216798000424, http://place.map.kakao.com/26469900
1590996045, 할리스 대구연경점, 카페, 대구 북구 동화천로 229, 128.616057121808, 35.9424114462311, http://place.map.kakao.com/1590996045
762630486, 할리스 낙산해수욕장점, 카페, 강원 양양군 강현면 해맞이길 18, 128.6311910574311, 38.11979134469596, http://place.map.kakao.com/762630486
630423458, 할리스 속초영랑해변점, 카페, 강원 속초시 영랑해안길 205, 128.593802735642, 38.2182445179238, http://place.map.kakao.com/630423458
235644267, 할리스 거제휴게소점, 카페, 경남 거제시 장목면 거가대로 1068, 128.693734056503, 34.9732365346746, http://place.map.kakao.com/235644267
1868627775, 할리스 밀양킹콩점, 카페, 경남 밀양시 삼문강변로 272, 128.74703533393, 35.4868302927938, http://place.map.kakao.com/1868627775
1807209465, 할리스 경산중방점, 카페, 경북 경산시 경안로 205, 128.7364626503362, 35.82585470897959, http://place.map.kakao.com/1807209465
325605611, 할리스 대구안심점, 카페, 대구 동구 안심로90길 29, 128.733938467016, 35.868388263674, http://place.map.kakao.com/325605611
17100700, 할리스 와촌휴게소점, 카페, 경북 경산시 와촌면 강학길 103, 128.775706976131, 35.9518480389077, http://place.map.kakao.com/17100700
226776957, 할리스 가덕휴게소점, 카페, 부산 강서구 거가대로 2571, 128.80724221615228, 35.023383579043994, http://place.map.kakao.com/226776957
592733193, 할리스 경산휴게소서울방향점, 카페, 경북 경산시 진량읍 대학로 1089, 128.810425366848, 35.8792984754336, http://place.map.kakao.com/592733193
17100697, 할리스 청통휴게소대구방향점, 카페, 경북 영천시 청통면 청통로 334-42, 128.859169892614, 35.9939478442295, http://place.map.kakao.com/17100697
2112029841, 할리스 명지국제신도시점, 카페, 부산 강서구 명지국제11로 57, 128.92489590400876, 35.10440946654172, http://place.map.kakao.com/2112029841
