1499746496, 할리스 부산사상광장점, 카페, 부산 사상구 광장로 22, 128.97893734035398, 35.16239517994929, http://place.map.kakao.com/1499746496
1175080660, 할리스 부산아트몰링영풍문고점, 카페, 부산 사하구 낙동남로 1413, 128.966474365215, 35.1067555083069, http://place.map.kakao.com/1175080660
1998783043, 할리스 김해복음병원점, 카페, 경남 김해시 활천로 42, 128.89371588788, 35.2313810950059, http://place.map.kakao.com/1998783043
1645860172, 할리스 김해인제대점, 카페, 경남 김해시 인제로 168, 128.90416019743773, 35.24360841951328, http://place.map.kakao.com/1645860172
447296939, 할리스 양산원동점, 카페, , 128.92524326401096, 35.359621873487036, http://place.map.kakao.com/447296939
21545450, 할리스 강릉항마리나점, 카페, 강원 강릉시 창해로14번길 51-20, 128.951106897044, 37.7723914574963, http://place.map.kakao.com/21545450
1285652801, 할리스 부산BIFF광장점, 카페, 부산 중구 비프광장로 31-1, 129.028574953107, 35.0989911032196, http://place.map.kakao.com/1285652801
1237798547, 할리스 부산송도점, 카페, 부산 서구 송도해변로 61-1, 129.015733968587, 35.0744625634903, http://place.map.kakao.com/1237798547
26990149, 할리스 부산서구청점, 카페, 부산 서구 보수대로 9, 129.0250076792009, 35.09764943047891, http://place.map.kakao.com/26990149
8641716, 할리스 부산서면본점, 카페, 부산 부산진구 동천로 73, 129.062147304653, 35.1552448164932, http://place.map.kakao.com/8641716
1633651426, 할리스 부산연산점, 카페, 부산 연제구 반송로 89, 129.0883869655156, 35.19152534688951, http://place.map.kakao.com/1633651426
2095500564, 할리스 동부산우체국점, 카페, 부산 동구 조방로 15, 129.062496647771, 35.1381347921967, http://place.map.kakao.com/2095500564
210229839, 할리스 부산중앙역점, 카페, 부산 중구 대청로 148, 129.03606553503357, 35.10274865297834, http://place.map.kakao.com/210229839
287482768, 할리스 부산시민공원점, 카페, 부산 부산진구 시민공원로 73, 129.05793961770772, 35.16906271300003, http://place.map.kakao.com/287482768
1957023553, 할리스 부산동의대점, 카페, 부산 부산진구 엄광로 176, 129.035026952628, 35.1441794274254, http://place.map.kakao.com/1957023553
335517928, 할리스 부산역사점, 카페, 부산 동구 중앙대로 206, 129.04140330068094, 35.11513197933013, http://place.map.kakao.com/335517928
900780241, 할리스 부산동래역점, 카페, 부산 동래구 삼성대길 34-25, 129.08173649038736, 35.20523378490798, http://place.map.kakao.com/900780241
565168867, 할리스 부산덕천점, 카페, 부산 북구 덕천1길 21, 129.006749883406, 35.209951758781344, http://place.map.kakao.com/565168867
2102914730, 할리스 부산금강식물원점, 카페, 부산 금정구 금샘로 22, 129.07799007191005, 35.22792066004667, http://place.map.kakao.com/2102914730
1748097104, 할리스 부산명륜역점, 카페, 부산 동래구 온천장로 5, 129.07871028641642, 35.21275814837528, http://place.map.kakao.com/1748097104
1698435126, 할리스 부산명륜자이점, 카페, 부산 동래구 동래로 77, 129.08148164698153, 35.20862649798062, http://place.map.kakao.com/1698435126
502353637, 할리스 부산화명점, 카페, 부산 북구 금곡대로285번길 13, 129.012739126931, 35.233720501303, http://place.map.kakao.com/502353637
27489249, 할리스 양산신도시점, 카페, 경남 양산시 물금읍 야리로 127, 129.00959296817413, 35.31152909902429, http://place.map.kakao.com/27489249
1143278627, 할리스 양산부산대병원본점, 카페, 경남 양산시 물금읍 금오로 20, 129.0061153115155, 35.3277598237559, http://place.map.kakao.com/1143278627
1813559803, 할리스 양산부산대병원치과동점, 카페, 경남 양산시 물금읍 금오로 20, 129.007131385308, 35.32696075526518, http://place.map.kakao.com/1813559803
27588083, 할리스 양산휴게소점, 카페, 경남 양산시 동면 목장길 15-50, 129.0564570731122, 35.32362273193159, http://place.map.kakao.com/27588083
26318038, 할리스 부산광안리점, 카페, 부산 수영구 광안해변로 175, 129.11556477876292, 35.15026829572439, http://place.map.kakao.com/26318038
578495332, 할리스 부산광안대교점, 카페, 부산 수영구 광안해변로 217, 129.118035895686, 35.1533250675262, http://place.map.kakao.com/578495332
27365973, 할리스 부산해운대점, 카페, 부산 해운대구 해운대해변로 277, 129.16169018029, 35.1598818291232, http://place.map.kakao.com/27365973
1474266378, 할리스 부산광안해변점, 카페, 부산 수영구 광안해변로 251, 129.121386412873, 35.1552525609668, http://place.map.kakao.com/1474266378
20124790, 할리스 부산달맞이점, 카페, 부산 해운대구 달맞이길 199, 129.18272802348693, 35.15866279291195, http://place.map.kakao.com/20124790
27456877, 할리스 부산경성대점, 카페, 부산 남구 용소로 7, 129.1006350397025, 35.13664224784207, http://place.map.kakao.com/27456877
229197552, 할리스 부산경성대2호점, 카페, 부산 남구 수영로 306, 129.099821437178, 35.1369131838125, http://place.map.kakao.com/229197552
2145810394, 할리스 부산센텀시티점, 카페, 부산 해운대구 센텀2로 24, 129.132394763519, 35.1667110676779, http://place.map.kakao.com/2145810394
13057664, 할리스 부산수영로터리점, 카페, 부산 수영구 수영로 710-1, 129.117221369326, 35.1677865568055, http://place.map.kakao.com/13057664
1128547882, 할리스 부산정관CGV점, 카페, 부산 기장군 정관읍 정관중앙로 45, 129.178263589824, 35.3211499284426, http://place.map.kakao.com/1128547882
2052948110, 할리스 동해촛대바위점, 카페, 강원 동해시 촛대바위길 16, 129.1589335907941, 37.47819627129244, http://place.map.kakao.com/2052948110
27387319, 할리스 동해묵호점, 카페, 강원 동해시 해안로 368, 129.114761337585, 37.5350136361538, http://place.map.kakao.com/27387319
20496641, 할리스 부산송정점, 카페, 부산 해운대구 송정광어골로 77, 129.1965543726894, 35.174674652371394, http://place.map.kakao.com/20496641
1763133443, 할리스 부산일광신도시점, 카페, 부산 기장군 일광읍 해빛6로 43-20, 129.225676499324, 35.264615375736, http://place.map.kakao.com/1763133443
21242255, 할리스 장안휴게소부산방향점, 카페, , 129.2460193168265, 35.379193135755166, http://place.map.kakao.com/21242255
19336859, 할리스 장안휴게소울산방향점, 카페, 부산 기장군 장안읍 동해고속도로 26, 129.24879728967224, 35.380970664786, http://place.map.kakao.com/19336859
830344235, 할리스 울산율리점, 카페, 울산 울주군 청량읍 율리영해1길 46, 129.239898815737, 35.5287343339789, http://place.map.kakao.com/830344235
27588080, 할리스 외동휴게소포항방향점, 카페, 경북 경주시 외동읍 상석길 58-70, 129.28842554652653, 35.67284406420369, http://place.map.kakao.com/27588080
27588076, 할리스 외동휴게소울산방향점, 카페, 경북 경주시 외동읍 상석길 58-74, 129.2854259277697, 35.672751491490445, http://place.map.kakao.com/27588076
19336952, 할리스 경주황성점, 카페, 경북 경주시 황성로28번길 15, 129.21602660248845, 35.864878956483274, http://place.map.kakao.com/19336952
26469911, 할리스 울산간절곶해맞이점, 카페, 울산 울주군 서생면 나사해안길 135, 129.345605055403, 35.3530735998457, http://place.map.kakao.com/26469911
1323823667, 할리스 울산디자인거리점, 카페, 울산 남구 돋질로302번길 38, 129.337144632145, 35.5406672186496, http://place.map.kakao.com/1323823667
1380069933, 할리스 울산삼산대로점, 카페, 울산 남구 정동로 71, 129.343678902787, 35.5403312928324, http://place.map.kakao.com/1380069933
487245327, 할리스 울산달동DT점, 카페, 울산 남구 번영로 82, 129.33031847916007, 35.532976389271894, http://place.map.kakao.com/487245327
1670973100, 할리스 울산시청점, 카페, 울산 남구 삼산로 60, 129.314181268668, 35.53369996253296, http://place.map.kakao.com/1670973100
1917190609, 할리스 울산신정점, 카페, 울산 남구 동산로 93, 129.305716071098, 35.5365779921229, http://place.map.kakao.com/1917190609
794243775, 할리스 울산삼산로점, 카페, 울산 남구 삼산로 283, 129.337902243965, 35.5397262385166, http://place.map.kakao.com/794243775
180511099, 할리스 울산명촌점, 카페, 울산 북구 명촌로 59, 129.357173959526, 35.5549859551034, http://place.map.kakao.com/180511099
1465880311, 할리스 울산성남점, 카페, 울산 중구 만남의거리 33, 129.320859925777, 35.5533804775891, http://place.map.kakao.com/1465880311
1386734416, 할리스 울산야음점, 카페, 울산 남구 수암로 138, 129.32192014079163, 35.52698419977654, http://place.map.kakao.com/1386734416
228588761, 할리스 울산교보핫트랙스점, 카페, 울산 남구 화합로 185, 129.338895093536, 35.5413432965395, http://place.map.kakao.com/228588761
1739336111, 할리스 울산공항1호점, 카페, 울산 북구 산업로 1103, 129.355891884131, 35.5929812556394, http://place.map.kakao.com/1739336111
349474271, 할리스 울산공항2호점, 카페, 울산 북구 산업로 1103, 129.35587366307274, 35.59296178897411, http://place.map.kakao.com/349474271
1178306521, 할리스 울산풍차DT점, 카페, 울산 북구 산업로 1440, 129.3453806506443, 35.634976930126484, http://place.map.kakao.com/1178306521
20172483, 할리스 경주보불로점, 카페, 경북 경주시 보불로 305, 129.306441347414, 35.8100193898767, http://place.map.kakao.com/20172483
